Title,Alternative Title,Description,Language,Creator,Title Source,Resource Class,ISO Topic Categories,Keyword,Date Issued,Temporal Coverage,Date Range,Spatial Coverage,Bounding Box,Resource Type,Format,Information,Download,MapServer,FeatureServer,ImageServer,ID,Identifier,Provider,Code,Member Of,Is Part Of,Status,Accrual Method,Date Accessioned,Rights,Access Rights,Suppressed,Child Record,File Size
,DVRPC Bicycle Stress v2 Shortest Paths,"Shows the results of the connectivity analysis, upon which the Regional Connectivity Priorities are based. The roads shown include LTS 1, 2 and 3 segments. The thicker the purple line, the more connections are made between census blocks using that road segment.",eng,DVRPC-GIS,Delaware Valley,Datasets,,BSTRESSv2_ShortestPaths|MapServer,2022-03-08T19:00:45.000Z,,,"Ardentown, Delaware|Delaware City, Delaware|Wilmington, Delaware|Elsmere, Delaware|New Castle County, Delaware|Ardencroft, Delaware|De/nj County, Delaware|Bellefonte, Delaware|Pea Patch County, Delaware|New Castle, Delaware|Arden, Delaware|Newark, Delaware|Newport, Delaware|Delaware|Delaware County, Pennsylvania|Chester, Pennsylvania|Philadelphia, Pennsylvania|Coatesville, Pennsylvania|Philadelphia County, Pennsylvania|Bucks County, Pennsylvania|Montgomery County, Pennsylvania|Berks County, Pennsylvania|Chester County, Pennsylvania|Reading, Pennsylvania|Pennsylvania|Burlington County, New Jersey|New Brunswick, New Jersey|Burlington, New Jersey|Beverly, New Jersey|Woodbury, New Jersey|Salem, New Jersey|Gloucester City, New Jersey|Middlesex County, New Jersey|Camden County, New Jersey|Bordentown, New Jersey|Salem County, New Jersey|Camden, New Jersey|Hunterdon County, New Jersey|Mercer County, New Jersey|Lambertville, New Jersey|Gloucester County, New Jersey|Trenton, New Jersey|New Jersey|North East, Maryland|Perryville, Maryland|Charlestown, Maryland|Elkton, Maryland|Cecil County, Maryland|Rising Sun, Maryland|Maryland","-76.0971,39.5197,-74.3839,40.6061",Vector data,Shapefile,https://dvrpc-dvrpcgis.opendata.arcgis.com/datasets/dvrpcgis::dvrpc-bicycle-stress-v2-shortest-paths,https://dvrpc-dvrpcgis.opendata.arcgis.com/datasets/dvrpcgis::dvrpc-bicycle-stress-v2-lts3-trail-results.zip,,https://arcgis.dvrpc.org/portal/rest/services/Transportation/BSTRESSv2_ShortestPaths/FeatureServer/0,,dvrpcgis::dvrpc-bicycle-stress-v2-shortest-paths,https://hub.arcgis.com/datasets/dvrpcgis::dvrpc-bicycle-stress-v2-shortest-paths,Delaware Valley Regional Planning Commission (DVRPC),04f-01,ba5cc745-21c5-4ae9-954b-72dd8db6815a,04f-01,Active,ArcGIS Hub,2022-03-27,,Public,False,False,1.0619 MB
,DVRPC Bicycle Stress v2 Trail Intersections,,eng,DVRPC-GIS,Delaware Valley,Datasets,,BSTRESSv2_TrailIntersections|MapServer,2022-03-08T19:01:04.000Z,,,"Ardentown, Delaware|Wilmington, Delaware|New Castle County, Delaware|Elsmere, Delaware|Ardencroft, Delaware|Bellefonte, Delaware|Newark, Delaware|New Castle, Delaware|Arden, Delaware|Newport, Delaware|Delaware|Delaware County, Pennsylvania|Chester, Pennsylvania|Philadelphia, Pennsylvania|Coatesville, Pennsylvania|Philadelphia County, Pennsylvania|Bucks County, Pennsylvania|Montgomery County, Pennsylvania|Chester County, Pennsylvania|Pennsylvania|Burlington County, New Jersey|Burlington, New Jersey|Beverly, New Jersey|Woodbury, New Jersey|Gloucester City, New Jersey|Camden County, New Jersey|Bordentown, New Jersey|Camden, New Jersey|Hunterdon County, New Jersey|Mercer County, New Jersey|Lambertville, New Jersey|Gloucester County, New Jersey|Trenton, New Jersey|New Jersey","-75.8974,39.6386,-74.4848,40.5941",Vector data,Shapefile,https://dvrpc-dvrpcgis.opendata.arcgis.com/datasets/dvrpcgis::dvrpc-bicycle-stress-v2-trail-intersections,https://dvrpc-dvrpcgis.opendata.arcgis.com/datasets/dvrpcgis::dvrpc-bicycle-stress-v2-trail-intersections.zip,,https://arcgis.dvrpc.org/portal/rest/services/Transportation/BSTRESSv2_TrailIntersections/FeatureServer/0,,dvrpcgis::dvrpc-bicycle-stress-v2-trail-intersections,https://hub.arcgis.com/datasets/dvrpcgis::dvrpc-bicycle-stress-v2-trail-intersections,Delaware Valley Regional Planning Commission (DVRPC),04f-01,ba5cc745-21c5-4ae9-954b-72dd8db6815a,04f-01,Active,ArcGIS Hub,2022-03-27,,Public,False,False,0.0418 MB
,PW Alleys,"For questions about this data please contactPublicWorksOpenData@minneapolismn.gov Attribute Overview : Alley centerline, Alley Right of Way only centerline, Text. Fields: Field Name Field Type Field Description OBJECTID Object ID Unique ID SYMBOL_NAME Text Graphic symbol name SEGMENT_ID Text Alley segment ID SECTION_ID Text Alley section ID PAVED Text Alley paved or unpaved MAINTENANCE_DISTRICT Long Integer Street maintenance district PLOW_ROUTE Text Alley plow route number WARD Text Council ward SEGMENT_LENGTH Double Graphic length COMMENTS Text Comments SOURCE Text Source of data SOURCE_DATE Date Source date ALLEY_CLINE_CREATED Date Graphic creation date ALLEY_CLINE_REVD Date Graphic revision date LEGAL_SOURCE Text Legal source Shape Geometry Geometry Shape.STLength() Double Graphic length Symbol Name Definitions: Symbol Name Definition ALLEY_RWAY Alley Centerline Right-of-Way Only ALLLEYDL Drivable Alley Centerline ",eng,MapIT Minneapolis,"Minneapolis, Minnesota",Datasets,,OpenData|Minneapolis|PublicWorks|Centerline|Alleys,2018-02-21T20:35:02.000Z,,,"Hennepin County, Minnesota|St. Anthony, Minnesota|Stearns County, Minnesota|Ramsey County, Minnesota|Anoka County, Minnesota|Minnesota","-93.3291,44.8908,-93.1996,45.0511",Vector data,Shapefile,https://opendata.minneapolismn.gov/datasets/cityoflakes::pw-alleys,https://opendata.minneapolismn.gov/datasets/cityoflakes::pw-alleys.zip,,https://services.arcgis.com/afSMGVsC7QlRK1kZ/arcgis/rest/services/PW_Alleys/FeatureServer/0,,cityoflakes::pw-alleys,https://hub.arcgis.com/datasets/cityoflakes::pw-alleys,Minneapolis Open Data,05c-01,ba5cc745-21c5-4ae9-954b-72dd8db6815a,05c-01,Active,ArcGIS Hub,2022-03-27,,Public,False,False,0.3221 MB
,Snow Emergency Xerxes Tags 2022,"This is the information about the number and location of tags (parking tickets) during this snow emergency. Tag data will be retained for all Snow Emergencies in each snow season, until there is five full seasons of snow emergencies. Disclaimer: At this point we only have the tag data enclosed for day 2 and day 3 the snow emergencies. Day 1 tag data is collected manually and is not available at this time electronically.",eng,MapIT Minneapolis,"Minneapolis, Minnesota",Datasets,,PublicWorks|Minneapolis|SnowEmergency|Tags|2022,2022-03-07T17:19:46.000Z,,,"Hennepin County, Minnesota|St. Anthony, Minnesota|Stearns County, Minnesota|Ramsey County, Minnesota|Anoka County, Minnesota|Minnesota","-93.3288,44.8911,-93.2050,45.0509",Vector data,Shapefile,https://opendata.minneapolismn.gov/datasets/cityoflakes::snow-emergency-xerxes-tags-2022,https://opendata.minneapolismn.gov/datasets/cityoflakes::pw-alleys.zip,https://tiles.arcgis.com/tiles/afSMGVsC7QlRK1kZ/arcgis/rest/services/Snow_Emergency_Xerxes_Tags_2022/MapServer/0,,,cityoflakes::snow-emergency-xerxes-tags-2022,https://hub.arcgis.com/datasets/cityoflakes::snow-emergency-xerxes-tags-2022,Minneapolis Open Data,05c-01,ba5cc745-21c5-4ae9-954b-72dd8db6815a,05c-01,Active,ArcGIS Hub,2022-03-27,,Public,False,False,0.3221 MB
,Snow Emergency Polk Tags 2016,"This is the information about the number and location of tags (parking tickets) during this snow emergency. Tag data will be retained for all Snow Emergencies in each snow season, until there is five full seasons of snow emergencies. Disclaimer: At this point we only have the tag data enclosed for day 2 and day 3 the snow emergencies. Day 1 tag data is collected manually and is not available at this time electronically. There is also an expected address error rate of between 5 and 10 percent.Snow Emergency Tags - 2015/2016 Season #2 Polk (2/2/16 thru 2/4/16) Field Name Field Type Field Description Citation Double 15 Citation Number Date Date Citation Date Address Text 254 Address of the citation X_Coord Double 15 X Coordinate - Geocode Y_Coord Double 15 Y Coordinate - Geocode Ordinance Text 254 Snow Emergency Parking Ordinance Ordinanc_1 Text 254 Snow Emergency Parking Ordinance Description Ward Double 15 Ward Location Neighborho Text 254 Neighborhood Location Community Text 254 Community Location Day_ID Text 254 Snow Emergency Day Identifier ",eng,MapIT Minneapolis,"Minneapolis, Minnesota",Datasets,,PublicWorks|Minneapolis|SnowEmergency|Tags|2016|parking,2016-03-31T15:37:28.000Z,,,"Hennepin County, Minnesota|St. Anthony, Minnesota|Stearns County, Minnesota|Ramsey County, Minnesota|Anoka County, Minnesota|Minnesota","-93.3279,44.8916,-93.2030,45.0503",Vector data,Shapefile,https://opendata.minneapolismn.gov/datasets/cityoflakes::snow-emergency-polk-tags-2016,https://opendata.minneapolismn.gov/datasets/cityoflakes::snow-emergency-polk-tags-2016.zip,,https://services.arcgis.com/afSMGVsC7QlRK1kZ/arcgis/rest/services/Snow_Emergency_Polk_Tags_2016/FeatureServer/0,,cityoflakes::snow-emergency-polk-tags-2016,https://hub.arcgis.com/datasets/cityoflakes::snow-emergency-polk-tags-2016,Minneapolis Open Data,05c-01,ba5cc745-21c5-4ae9-954b-72dd8db6815a,05c-01,Active,ArcGIS Hub,2022-03-27,,Public,False,False,0.1564 MB
,Snow Emergency Zenith Tags 2022,"This is the information about the number and location of tags (parking tickets) during this snow emergency. Tag data will be retained for all Snow Emergencies in each snow season, until there is five full seasons of snow emergencies. Disclaimer: At this point we only have the tag data enclosed for day 2 and day 3 the snow emergencies. Day 1 tag data is collected manually and is not available at this time electronically. ",eng,MapIT Minneapolis,"Minneapolis, Minnesota",Datasets,,Minneapolis|OpenData|SnowEmergency|Tags|2022,2022-03-24T23:04:37.000Z,,,"Hennepin County, Minnesota|St. Anthony, Minnesota|Stearns County, Minnesota|Ramsey County, Minnesota|Anoka County, Minnesota|Minnesota","-93.3275,44.8913,-93.2050,45.0494",Vector data,Shapefile,https://opendata.minneapolismn.gov/datasets/cityoflakes::snow-emergency-zenith-tags-2022,https://opendata.minneapolismn.gov/datasets/cityoflakes::snow-emergency-polk-tags-2016.zip,https://tiles.arcgis.com/tiles/afSMGVsC7QlRK1kZ/arcgis/rest/services/Snow_Emergency_Zenith_Tags_2022/MapServer/0,,,cityoflakes::snow-emergency-zenith-tags-2022,https://hub.arcgis.com/datasets/cityoflakes::snow-emergency-zenith-tags-2022,Minneapolis Open Data,05c-01,ba5cc745-21c5-4ae9-954b-72dd8db6815a,05c-01,Active,ArcGIS Hub,2022-03-27,,Public,False,False,0.1564 MB
,Snow Emergency Xerxes Tows 2022,"This is the information about the number and location of tows during this snow emergency. Tow data will be retained for all Snow Emergencies in each snow season, until there is five full seasons of snow emergencies. Disclaimer: There is an expected address error rate of between 8 and 14 percent. ",eng,MapIT Minneapolis,"Minneapolis, Minnesota",Datasets,,PublicWorks|Minneapolis|SnowEmergency|Tows|2022,2022-03-07T17:45:35.000Z,,,"Fridley, Minnesota|Columbia Heights, Minnesota|Hilltop, Minnesota|Spring Lake Park, Minnesota|Ramsey County, Minnesota|Anoka County, Minnesota|Hennepin County, Minnesota|Richfield, Minnesota|Minnesota","-93.3150,44.8535,-93.2177,45.1974",Vector data,Shapefile,https://opendata.minneapolismn.gov/datasets/cityoflakes::snow-emergency-xerxes-tows-2022,https://opendata.minneapolismn.gov/datasets/cityoflakes::pw-alleys.zip,https://tiles.arcgis.com/tiles/afSMGVsC7QlRK1kZ/arcgis/rest/services/Snow_Emergency_Xerxes_Tows_2022/MapServer/0,,,cityoflakes::snow-emergency-xerxes-tows-2022,https://hub.arcgis.com/datasets/cityoflakes::snow-emergency-xerxes-tows-2022,Minneapolis Open Data,05c-01,ba5cc745-21c5-4ae9-954b-72dd8db6815a,05c-01,Active,ArcGIS Hub,2022-03-27,,Public,False,False,0.3221 MB
,Snow Emergency Zenith Tows 2022,"This is the information about the number and location of tows during this snow emergency. Tow data will be retained for all Snow Emergencies in each snow season, until there is five full seasons of snow emergencies. Disclaimer: There is an expected address error rate of between 8 and 14 percent. Snow Emergency Tows - 2021/2022 Season #3 Zenith (3/6/22 thru 3/8/22) ",eng,MapIT Minneapolis,"Minneapolis, Minnesota",Datasets,,Minneapolis|OpenData|SnowEmergency|Tows|2022,2022-03-24T23:30:50.000Z,,,"Fridley, Minnesota|Columbia Heights, Minnesota|Hilltop, Minnesota|Spring Lake Park, Minnesota|Ramsey County, Minnesota|Anoka County, Minnesota|Hennepin County, Minnesota|Minnesota","-93.3149,44.8535,-93.2089,45.1974",Vector data,Shapefile,https://opendata.minneapolismn.gov/datasets/cityoflakes::snow-emergency-zenith-tows-2022,https://opendata.minneapolismn.gov/datasets/cityoflakes::snow-emergency-polk-tags-2016.zip,https://tiles.arcgis.com/tiles/afSMGVsC7QlRK1kZ/arcgis/rest/services/Snow_Emergency_Zenith_Tows_2022/MapServer/0,,,cityoflakes::snow-emergency-zenith-tows-2022,https://hub.arcgis.com/datasets/cityoflakes::snow-emergency-zenith-tows-2022,Minneapolis Open Data,05c-01,ba5cc745-21c5-4ae9-954b-72dd8db6815a,05c-01,Active,ArcGIS Hub,2022-03-27,,Public,False,False,0.1564 MB
