Title,Alternative Title,Description,Language,Creator,Title Source,Resource Class,ISO Topic Categories,Keyword,Date Issued,Temporal Coverage,Date Range,Spatial Coverage,Bounding Box,Resource Type,Format,Information,Download,MapServer,FeatureServer,ImageServer,ID,Identifier,Provider,Code,Member Of,Is Part Of,Status,Accrual Method,Date Accessioned,Rights,Access Rights,Suppressed,Child Record,File Size
,Top 15 Metros,"This layer shows Household Pulse Survey data on gender identity and sexual orientation. Gender identity is the internal perception ofgender, and how one identifiesbased on how one aligns or doesn't align with cultural options for gender. This is a different concept thansex assigned at birth. Sexual orientation is the type of sexualattraction one has the capacity to feel forothers, generally labeled based on the gender relationship between the person and the people they are attracted to. This is not the same as sexual behavior or preference.Learn more abouthow the Census Bureau surveymeasuressexual orientation and gender identity. This page includes nation-wide characteristics such as age, Hispanic origin and race, and educational attainment. Also read some of their findings about experiences during the COVID-19 pandemic, such as lesbian, gay, bisexual, or transgender (LGBT)adults experiencing higher rates of both economic hardship and mental health hardship. See thequestionnaireused in phase 3.2 of theHousehold Pulse Survey.Source:Household Pulse Survey Data Tables.Data values in this layer are fromWeek 34 (July 21 - August 2, 2021), the first week that gender identity and sexual orientation questions were part of this survey. Top 15 metros are based on total population and are the same 15 metros available for all Household Pulse Data Tables.This layer is symbolized to show the percent of adults who are lesbian, gay, bisexual, or transgender (LGBT) as well as adults whose gender or sexual orientation was not listed on the survey (LGBTQIA+). The color of the symbol depicts the percentage and the size of the symbol depicts the count. *Percent calculations do not use those who did not report either their gender or sexual orientation in either the numerator or denominator, consistent with methodology used by the source.*Data Prep Steps:Data prep used Table 1 (Child Tax Credit Payment Status and Use, by Select Characteristics) to perform tabular data transformation. SAS to Table conversion tool was used to bring the tables into ArcGIS Pro.The data is joined to 2019TIGER boundariesfrom theU.S. Census Bureau.Using the counties in each metro according to theMetropolitan and Micropolitan Statistical Area Reference Files, metro boundaries created via Merge and Dissolve tools in ArcGIS Pro.In preparing the field aliases and long descriptions, ""none of these"" and ""something else"" were generally modified to ""not listed.""",eng,Urban Observatory by Esri,Esri,Datasets,,LGBTQIA+|gender|sexualorientation|HouseholdPulseSurvey|demographics|policy,2021-10-25T09:31:16.000Z,,,United States,"-123.0241,25.1374,-70.5256,48.2990",Vector data,Shapefile,https://gis-for-racialequity.hub.arcgis.com/datasets/UrbanObservatory::top-15-metros,,,https://services1.arcgis.com/4yjifSiIG17X0gW4/arcgis/rest/services/Gender_Identity_and_Sexual_Orientation/FeatureServer/2,https://naip.arcgis.com/arcgis/rest/services/NAIP/ImageServer,UrbanObservatory::top-15-metros,https://hub.arcgis.com/datasets/UrbanObservatory::top-15-metros,Esri GIS For Racial Equity Hub,99-1100,ba5cc745-21c5-4ae9-954b-72dd8db6815a,99-1100,Active,ArcGIS Hub,2022-03-27,,Public,False,False,0.1944 MB
,"Low birth weight prevalence by county, 2010-2014","This layer contains data on Low Birth Weight Prevalence by county, 2010-2014. Data is represented as a percentage of total births. Data come from Centers for Disease Control and Prevention's Health Indicators Warehouse,formerly healthindicators.gov, site was taken down April 15th, 2017. Data will eventually be available onHealthyPeople.gov. Layer uses county-level data with 5-year averages from 2010-2014.For more information on low birth weight, preterm births, and policy, see the accompanyingLow Birth Weight story map.",eng,Urban Observatory by Esri,Esri,Datasets,,lowbirthweight|demographics|publichealth|lowbirthweight|infants|newborns|babies|childwell-being|Women|publichealth|PeopleandSociety|HealthandHumanServices|people|urban|maternalandchildhealth,2017-04-12T00:01:58.000Z,,,United States,"-179.2311,-14.6018,179.8597,71.4411",Vector data,Shapefile,https://gis-for-racialequity.hub.arcgis.com/datasets/UrbanObservatory::low-birth-weight-prevalence-by-county-2010-2014,https://gis-for-racialequity.hub.arcgis.com/datasets/UrbanObservatory::low-birth-weight-prevalence-by-county-2010-2014.zip,,https://services1.arcgis.com/4yjifSiIG17X0gW4/arcgis/rest/services/Low_birth_weight_by_county_2010_2014/FeatureServer/0,,UrbanObservatory::low-birth-weight-prevalence-by-county-2010-2014,https://hub.arcgis.com/datasets/UrbanObservatory::low-birth-weight-prevalence-by-county-2010-2014,Esri GIS For Racial Equity Hub,99-1100,ba5cc745-21c5-4ae9-954b-72dd8db6815a,99-1100,Active,ArcGIS Hub,2022-03-27,,Public,False,False,90.2869 MB
,2016 ACS Health Insurance by Age and Gender - Tract,"This layer shows the percentage of thecivilian noninstitutionalized population who do not have insurance.This is shown by census tract centroids. The data values are from the 2012-2016 American Community Survey 5-year estimate in theB27001 Tablefor health insurance coverage status broken down by by age and sex characteristics.This map helps to answer a few questions:How many people in the United States don't have health insurance?Where are the concentrations of uninsured population?This map helps to tell a local pattern about insurance in the United States. The data can be stratified by different age and sex characteristics in order to create additional maps. By default, the pop-up provides a breakdown of total male and female uninsured population.This data was downloaded from the United States Census Bureau American Fact Finder on March 1, 2018. It was then joined with 2016 vintage centroid points and hosted to ArcGIS Online and into the Living Atlas. The data contains additional attributes that can be used for mapping and analysis.Nationally, the breakdown of insurance for the civilian noninstitutionalized population in the US is: Total: 313,576,137 +/-10,365 Male: 153,162,940 +/-12,077 Under 6 years: 12,227,441 +/-11,224 With health insurance coverage 11,643,526 +/-12,783 No health insurance coverage 583,915 +/-6,438 6 to 17 years: 25,282,489 +/-12,396 With health insurance coverage 23,659,835 +/-16,339 No health insurance coverage 1,622,654 +/-14,500 18 to 24 years: 15,350,990 +/-8,369 With health insurance coverage 12,112,729 +/-19,586 No health insurance coverage 3,238,261 +/-24,081 25 to 34 years: 20,901,264 +/-8,155 With health insurance coverage 15,669,472 +/-36,401 No health insurance coverage 5,231,792 +/-38,887 35 to 44 years: 19,499,072 +/-6,321 With health insurance coverage 15,722,620 +/-41,969 No health insurance coverage 3,776,452 +/-41,916 45 to 54 years: 20,965,500 +/-5,283 With health insurance coverage 17,819,431 +/-33,014 No health insurance coverage 3,146,069 +/-31,181 55 to 64 years: 19,068,251 +/-3,959 With health insurance coverage 17,076,497 +/-20,830 No health insurance coverage 1,991,754 +/-19,813 65 to 74 years: 12,168,198 +/-3,453 With health insurance coverage 12,041,594 +/-4,736 No health insurance coverage 126,604 +/-3,207 75 years and over: 7,699,735 +/-3,458 With health insurance coverage 7,657,815 +/-3,794 No health insurance coverage 41,920 +/-1,719 Female: 160,413,197 +/-8,724 Under 6 years: 11,684,980 +/-10,395 With health insurance coverage 11,115,775 +/-13,062 No health insurance coverage 569,205 +/-7,132 6 to 17 years: 24,280,468 +/-11,445 With health insurance coverage 22,723,174 +/-14,642 No health insurance coverage 1,557,294 +/-13,468 18 to 24 years: 15,151,707 +/-5,432 With health insurance coverage 12,591,379 +/-16,744 No health insurance coverage 2,560,328 +/-18,826 25 to 34 years: 21,367,510 +/-4,829 With health insurance coverage 17,505,087 +/-32,122 No health insurance coverage 3,862,423 +/-31,651 35 to 44 years: 20,279,901 +/-4,751 With health insurance coverage 17,146,763 +/-32,076 No health insurance coverage 3,133,138 +/-31,659 45 to 54 years: 21,975,842 +/-5,087 With health insurance coverage 19,083,932 +/-27,415 No health insurance coverage 2,891,910 +/-25,022 55 to 64 years: 20,665,987 +/-3,867 With health insurance coverage 18,537,874 +/-18,484 No health insurance coverage 2,128,113 +/-16,614 65 to 74 years: 13,896,484 +/-3,882 With health insurance coverage 13,730,727 +/-6,177 No health insurance coverage 165,757 +/-3,857 75 years and over: 11,110,318 +/-3,977 With health insurance coverage 11,037,661 +/-4,391 No health insurance coverage 72,657 +/-2,120 Data note from the US Census Bureau:[ACS] data are based on a sample and are subject to sampling variability. The degree of uncertainty for an estimate arising from sampling variability is represented through the use of a margin of error. The value shown here is the 90 percent margin of error. The margin of error can be interpreted roughly as providing a 90 percent probability that the interval defined by the estimate minus the margin of error and the estimate plus the margin of error (the lower and upper confidence bounds) contains the true value. In addition to sampling variability, the ACS estimates are subject to nonsampling error (for a discussion of nonsampling variability, see Accuracy of the Data). The effect of nonsampling error is not represented in these tables.",eng,ArcGIS Living Atlas Team,Esri,Datasets,,ACS|Census|demographics|population|healthcare|healthinsurance|insurance|AmericanCommunitySurvey|AmericanFactFinder|counties|county|USA|US|civilian|Civiliannoninstitutionalizedpopulation|noninstitutionalizedpopulation|age|gender|sex|male|female|men|women|health|people|tract|censustract|tracts,2018-03-16T00:59:59.000Z,,,United States,"-171.7333,19.1132,-66.9985,71.2967",Vector data,Shapefile,https://gis-for-racialequity.hub.arcgis.com/datasets/arcgis-content::2016-acs-health-insurance-by-age-and-gender-tract,https://gis-for-racialequity.hub.arcgis.com/datasets/arcgis-content::2016-acs-health-insurance-by-age-and-gender-tract.zip,,https://services.arcgis.com/jIL9msH9OI208GCb/arcgis/rest/services/ACS_2016_Health_Insurance_by_Age_and_Gender_Tract/FeatureServer/0,,arcgis-content::2016-acs-health-insurance-by-age-and-gender-tract,https://hub.arcgis.com/datasets/arcgis-content::2016-acs-health-insurance-by-age-and-gender-tract,Esri GIS For Racial Equity Hub,99-1100,ba5cc745-21c5-4ae9-954b-72dd8db6815a,99-1100,Active,ArcGIS Hub,2022-03-27,,Public,False,False,13.6626 MB
,2016 ACS Health Insurance by Age and Gender - County,"This layer shows the percentage of thecivilian noninstitutionalized population who do not have insurance.This is shown by county centroids. The data values are from the 2012-2016 American Community Survey 5-year estimate in theB27001 Tablefor health insurance coverage status broken down by by age and sex characteristics.This map helps to answer a few questions:How many people in the United States don't have health insurance?Where are the concentrations of uninsured population?This map helps to tell a regional pattern about insurance in the United States. The data can be stratified by different age and sex characteristics in order to create additional maps. By default, the pop-up provides a breakdown of total male and female uninsured population.This data was downloaded from the United States Census Bureau American Fact Finder on March 1, 2018. It was then joined with 2016 vintage centroid points and hosted to ArcGIS Online and into the Living Atlas. The data contains additional attributes that can be used for mapping and analysis.Nationally, the breakdown of insurance for the civilian noninstitutionalized population in the US is:Total:313,576,137+/-10,365Male:153,162,940+/-12,077Under 6 years:12,227,441+/-11,224With health insurance coverage11,643,526+/-12,783No health insurance coverage583,915+/-6,4386 to 17 years:25,282,489+/-12,396With health insurance coverage23,659,835+/-16,339No health insurance coverage1,622,654+/-14,50018 to 24 years:15,350,990+/-8,369With health insurance coverage12,112,729+/-19,586No health insurance coverage3,238,261+/-24,08125 to 34 years:20,901,264+/-8,155With health insurance coverage15,669,472+/-36,401No health insurance coverage5,231,792+/-38,88735 to 44 years:19,499,072+/-6,321With health insurance coverage15,722,620+/-41,969No health insurance coverage3,776,452+/-41,91645 to 54 years:20,965,500+/-5,283With health insurance coverage17,819,431+/-33,014No health insurance coverage3,146,069+/-31,18155 to 64 years:19,068,251+/-3,959With health insurance coverage17,076,497+/-20,830No health insurance coverage1,991,754+/-19,81365 to 74 years:12,168,198+/-3,453With health insurance coverage12,041,594+/-4,736No health insurance coverage126,604+/-3,20775 years and over:7,699,735+/-3,458With health insurance coverage7,657,815+/-3,794No health insurance coverage41,920+/-1,719Female:160,413,197+/-8,724Under 6 years:11,684,980+/-10,395With health insurance coverage11,115,775+/-13,062No health insurance coverage569,205+/-7,1326 to 17 years:24,280,468+/-11,445With health insurance coverage22,723,174+/-14,642No health insurance coverage1,557,294+/-13,46818 to 24 years:15,151,707+/-5,432With health insurance coverage12,591,379+/-16,744No health insurance coverage2,560,328+/-18,82625 to 34 years:21,367,510+/-4,829With health insurance coverage17,505,087+/-32,122No health insurance coverage3,862,423+/-31,65135 to 44 years:20,279,901+/-4,751With health insurance coverage17,146,763+/-32,076No health insurance coverage3,133,138+/-31,65945 to 54 years:21,975,842+/-5,087With health insurance coverage19,083,932+/-27,415No health insurance coverage2,891,910+/-25,02255 to 64 years:20,665,987+/-3,867With health insurance coverage18,537,874+/-18,484No health insurance coverage2,128,113+/-16,61465 to 74 years:13,896,484+/-3,882With health insurance coverage13,730,727+/-6,177No health insurance coverage165,757+/-3,85775 years and over:11,110,318+/-3,977With health insurance coverage11,037,661+/-4,391No health insurance coverage72,657+/-2,120Data note from the US Census Bureau:[ACS] data are based on a sample and are subject to sampling variability. The degree of uncertainty for an estimate arising from sampling variability is represented through the use of a margin of error. The value shown here is the 90 percent margin of error. The margin of error can be interpreted roughly as providing a 90 percent probability that the interval defined by the estimate minus the margin of error and the estimate plus the margin of error (the lower and upper confidence bounds) contains the true value. In addition to sampling variability, the ACS estimates are subject to nonsampling error (for a discussion of nonsampling variability, see Accuracy of the Data). The effect of nonsampling error is not represented in these tables.",eng,ArcGIS Living Atlas Team,Esri,Datasets,,ACS|Census|demographics|population|healthcare|healthinsurance|insurance|AmericanCommunitySurvey|AmericanFactFinder|counties|county|USA|US|civilian|Civiliannoninstitutionalizedpopulation|noninstitutionalizedpopulation|age|gender|sex|male|female|men|women|health|people,2018-03-16T00:44:03.000Z,,,United States,"-166.5000,19.6726,-67.4645,70.5402",Vector data,Shapefile,https://gis-for-racialequity.hub.arcgis.com/datasets/arcgis-content::2016-acs-health-insurance-by-age-and-gender-county,https://gis-for-racialequity.hub.arcgis.com/datasets/arcgis-content::2016-acs-health-insurance-by-age-and-gender-county.zip,,https://services.arcgis.com/jIL9msH9OI208GCb/arcgis/rest/services/ACS_2016_Health_Insurance_by_Age_and_Gender_County/FeatureServer/0,,arcgis-content::2016-acs-health-insurance-by-age-and-gender-county,https://hub.arcgis.com/datasets/arcgis-content::2016-acs-health-insurance-by-age-and-gender-county,Esri GIS For Racial Equity Hub,99-1100,ba5cc745-21c5-4ae9-954b-72dd8db6815a,99-1100,Active,ArcGIS Hub,2022-03-27,,Public,False,False,0.8093 MB
,USA Education Level of Women in Poverty,"This layer highlights the education status of women 25 or older, living below the poverty line. Compare this map to theEducation Level of Men in Povertyfor additional perspective, or use theEducation Level of Women and Men in Poverty in the United Statesapp to do a side by side comparison.Thepoverty linevaries due to family size, state of residence, and other factors. TheUS Census normalizes the data by placing each respondent into an income category related to the poverty line. The Census then reports education levels for men and women above and below the poverty line.The US CensusAmerican Community Surveyis an ongoing survey. These estimates were created from data collectedfrom 2010 to 2014 and shown at the tract level. The tract borders are not shown to emphasizepatterns.",eng,ArcGIS Living Atlas Team,Esri,Datasets,,ACS|women|poverty|education|UnitedStates|US|NorthAmerica|income|demographics|policy,2016-08-04T23:38:56.000Z,,,United States,"-179.1473,18.9117,-66.9501,71.3896",Vector data,Shapefile,https://gis-for-racialequity.hub.arcgis.com/datasets/arcgis-content::usa-education-level-of-women-in-poverty,https://gis-for-racialequity.hub.arcgis.com/datasets/arcgis-content::2016-acs-health-insurance-by-age-and-gender-county.zip,,https://services.arcgis.com/jIL9msH9OI208GCb/arcgis/rest/services/Education_level_of_poor_women_v2/FeatureServer/0,,arcgis-content::usa-education-level-of-women-in-poverty,https://hub.arcgis.com/datasets/arcgis-content::usa-education-level-of-women-in-poverty,Esri GIS For Racial Equity Hub,99-1100,ba5cc745-21c5-4ae9-954b-72dd8db6815a,99-1100,Active,ArcGIS Hub,2022-03-27,,Public,False,False,0.8093 MB
,States,"This layer shows Household Pulse Survey data on gender identity and sexual orientation. Gender identity is the internal perception ofgender, and how one identifiesbased on how one aligns or doesn't align with cultural options for gender. This is a different concept thansex assigned at birth. Sexual orientation is the type of sexualattraction one has the capacity to feel forothers, generally labeled based on the gender relationship between the person and the people they are attracted to. This is not the same as sexual behavior or preference.Learn more abouthow the Census Bureau surveymeasuressexual orientation and gender identity. This page includes nation-wide characteristics such as age, Hispanic origin and race, and educational attainment. Also read some of their findings about experiences during the COVID-19 pandemic, such as lesbian, gay, bisexual, or transgender (LGBT)adults experiencing higher rates of both economic hardship and mental health hardship. See thequestionnaireused in phase 3.2 of theHousehold Pulse Survey.Source:Household Pulse Survey Data Tables.Data values in this layer are fromWeek 34 (July 21 - August 2, 2021), the first week that gender identity and sexual orientation questions were part of this survey. Top 15 metros are based on total population and are the same 15 metros available for all Household Pulse Data Tables.This layer is symbolized to show the percent of adults who are lesbian, gay, bisexual, or transgender (LGBT) as well as adults whose gender or sexual orientation was not listed on the survey (LGBTQIA+). The color of the symbol depicts the percentage and the size of the symbol depicts the count. *Percent calculations do not use those who did not report either their gender or sexual orientation in either the numerator or denominator, consistent with methodology used by the source.*Data Prep Steps:Data prep used Table 1 (Child Tax Credit Payment Status and Use, by Select Characteristics) to perform tabular data transformation. SAS to Table conversion tool was used to bring the tables into ArcGIS Pro.The data is joined to 2019TIGER boundariesfrom theU.S. Census Bureau.Using the counties in each metro according to theMetropolitan and Micropolitan Statistical Area Reference Files, metro boundaries created via Merge and Dissolve tools in ArcGIS Pro.In preparing the field aliases and long descriptions, ""none of these"" and ""something else"" were generally modified to ""not listed.""",eng,Urban Observatory by Esri,Esri,Datasets,,LGBTQIA+|gender|sexualorientation|HouseholdPulseSurvey|demographics|policy,2021-10-25T09:31:16.000Z,,,United States,"-179.1474,18.9175,179.7785,71.3526",Vector data,Shapefile,https://gis-for-racialequity.hub.arcgis.com/datasets/UrbanObservatory::states-2,https://gis-for-racialequity.hub.arcgis.com/datasets/UrbanObservatory::states-2.zip,,https://services1.arcgis.com/4yjifSiIG17X0gW4/arcgis/rest/services/Gender_Identity_and_Sexual_Orientation/FeatureServer/1,,UrbanObservatory::states-2,https://hub.arcgis.com/datasets/UrbanObservatory::states-2,Esri GIS For Racial Equity Hub,99-1100,ba5cc745-21c5-4ae9-954b-72dd8db6815a,99-1100,Active,ArcGIS Hub,2022-03-27,,Public,False,False,11.0963 MB
,Nation,"This layer shows Household Pulse Survey data on gender identity and sexual orientation. Gender identity is the internal perception ofgender, and how one identifiesbased on how one aligns or doesn't align with cultural options for gender. This is a different concept thansex assigned at birth. Sexual orientation is the type of sexualattraction one has the capacity to feel forothers, generally labeled based on the gender relationship between the person and the people they are attracted to. This is not the same as sexual behavior or preference.Learn more abouthow the Census Bureau surveymeasuressexual orientation and gender identity. This page includes nation-wide characteristics such as age, Hispanic origin and race, and educational attainment. Also read some of their findings about experiences during the COVID-19 pandemic, such as lesbian, gay, bisexual, or transgender (LGBT)adults experiencing higher rates of both economic hardship and mental health hardship. See thequestionnaireused in phase 3.2 of theHousehold Pulse Survey.Source:Household Pulse Survey Data Tables.Data values in this layer are fromWeek 34 (July 21 - August 2, 2021), the first week that gender identity and sexual orientation questions were part of this survey. Top 15 metros are based on total population and are the same 15 metros available for all Household Pulse Data Tables.This layer is symbolized to show the percent of adults who are lesbian, gay, bisexual, or transgender (LGBT) as well as adults whose gender or sexual orientation was not listed on the survey (LGBTQIA+). The color of the symbol depicts the percentage and the size of the symbol depicts the count. *Percent calculations do not use those who did not report either their gender or sexual orientation in either the numerator or denominator, consistent with methodology used by the source.*Data Prep Steps:Data prep used Table 1 (Child Tax Credit Payment Status and Use, by Select Characteristics) to perform tabular data transformation. SAS to Table conversion tool was used to bring the tables into ArcGIS Pro.The data is joined to 2019TIGER boundariesfrom theU.S. Census Bureau.Using the counties in each metro according to theMetropolitan and Micropolitan Statistical Area Reference Files, metro boundaries created via Merge and Dissolve tools in ArcGIS Pro.In preparing the field aliases and long descriptions, ""none of these"" and ""something else"" were generally modified to ""not listed.""",eng,Urban Observatory by Esri,Esri,Datasets,,LGBTQIA+|gender|sexualorientation|HouseholdPulseSurvey|demographics|policy,2021-10-25T09:31:16.000Z,,,United States,"-179.1474,17.8848,179.7785,71.3526",Vector data,Shapefile,https://gis-for-racialequity.hub.arcgis.com/datasets/UrbanObservatory::nation-3,https://gis-for-racialequity.hub.arcgis.com/datasets/UrbanObservatory::states-2.zip,,https://services1.arcgis.com/4yjifSiIG17X0gW4/arcgis/rest/services/Gender_Identity_and_Sexual_Orientation/FeatureServer/0,,UrbanObservatory::nation-3,https://hub.arcgis.com/datasets/UrbanObservatory::nation-3,Esri GIS For Racial Equity Hub,99-1100,ba5cc745-21c5-4ae9-954b-72dd8db6815a,99-1100,Active,ArcGIS Hub,2022-03-27,,Public,False,False,11.0963 MB
