Title,Alternative Title,Description,Language,Creator,Publisher,Genre,Subject,Keyword,Date Issued,Temporal Coverage,Date Range,Solr Year,Spatial Coverage,Bounding Box,Type,Geometry Type,Format,Information,Download,MapServer,FeatureServer,ImageServer,Identifier,Provenance,Code,Is Part Of,Status,Accrual Method,Date Accessioned,Rights,Access Rights,Suppressed,Child
,School COVID-19 Cases by The Covid Monitor,"For full metadata and data details, visitTheCovidMonitor.comHow we gather and publish dataState agencies and school districtsIf a state's health or education office releases data about cases in schools, we use that data first. If districts are reporting independently of their state, we consider that official, authoritative data, as well. This data is considered our most authoritative resource for cases in K-12 schools across the country.News and mediaNews articles, press releases, and interviews with school officials with local media help keep our region managers up to date on cases in their focus areas. We make sure each article we use to verify information includes a statement from the school or school district, whether directly or through emails/letters sent to parents.If the article relates to a school district and/or state that is already reporting, we check to make sure the numbers line up, and inquire with the school, state or district if they don't.If the article relates to a school or districtnotreporting in any official capacity, in a state that does not report cases, we build a file for that districts and remove any duplicate reports before adding the cases.Public reportingThe public depends on us to keep them informed, and we depend on communities to help us do that. By submitting information about cases throughour safe and 100% anonymous form, parents, teachers and even students keep us and each other up-to-date with the latest information available.Verifying Public ReportsHow we verify public reports depends on the type of report we receive. Reports with links to information are most likely to be added to our dataset, though we work to investigate those cases where additional information is needed.If we receive a report that links us to an official district or state website, we add the data to our official counts without any other needed steps, and we keep the link to the resource for future use.If a reports includes a link to a news article, press release or other official publications where a school official has confirmed the cases reported, we add that information to our counts.If we receive a report with a letter or email from a school, or if no official data resource is available to verify the information submitted, we first reach out to the school itself to get confirmation. If the school does not outright deny the report, we look for additional resources to verify the information, either through additional reports we've received, social media posts, and school contacts that cannot speak on the record, but are trusted resources.Even if we can't confirm a report with 100% certainty, we keep the report in our ""pending"" data until more information is received.Best Practices for Data ReportingInformation is one of our most important tools in this pandemic. Reporting cases and information related to COVID-19 timely is very important because we need good data to make informed decisions. Here is a list of things to consider when reporting data for your school.Keep patient data confidentialDon't publish names or any other kind of identifying information.Even if names are redacted, enough information about an individual can be sufficient to identify them.Take accessibility into considerationPublished information should be easily accessible to people even if they have special accessibility requirements, such as screen readers.Simpler formats, such tables on web pages, work much better for all kinds of users.Publish timely updates of the dataData should be updated timely and regularly.The latest data is useful, but historical data is very important as well.Historical data can be used to assess effectiveness of policies, such as specific guidelines regarding mask usage and social distancing.Historical data can be corrected if mistakes are made.Use consistent formattingUsing a consistent formatting makes it easier for students and parents to understand what it says.Consistent formatting enables others to make use of this data for a variety of purposes, from dashboards to research.State data report cardsWe grade states based on how much detail they provide at the state, district and school level.There are three primary levels of reporting data: state totals, totals by district, and totals by school, as shown in the chart below. We're working to include additional granularity in reporting grades- like whether or not states are reporting totals by case type (students versus staff), school or grade level (elementary, middle and high), and additional details related to cases in schools (e.g. quarantines). This grade is specific to data about cases in K-12 schools, and not related to any other type or level of data reported by the state. What is considered ""limited"" reporting?States often report limited data of each of the three main subject areas, meaning they will only specify the number of cases per district or school if a certain number of cases have been confirmed there. In South Carolina, districts with fewer than five cases are shown as ""<5."" Other states only report cases related to ""outbreaks,"" a definition that also varies by state. If the data data is masked or restricted in any way, it's considered ""limited"" reporting.",English,COVID Action,Esri,Geospatial data,,Florida|COVID|Monitor|Action|Watch|Case|Count|Tally|search|info|data|source|state|agency|education|teacher|staff|report|anonymous|official|K-12|K12|COVID19|COVID-19|Coronavirus|school|middle|elementary|high|safe,2020-09-04T00:36:32.000Z,,,,United States,"['-177.3500', '-14.2672', '179.6212', '69.4493']",Dataset|Service,Vector,Shapefile,https://coronavirus-resources.esri.com/datasets/35bafb81f59d40399e75743ac9b04d7b_0,https://coronavirus-resources.esri.com/datasets/35bafb81f59d40399e75743ac9b04d7b_0.zip,,https://services2.arcgis.com/QTlu74VtgQxQNkN3/arcgis/rest/services/Official_School_COVID_19_Case_Counts_by_The_Covid_Monitor/FeatureServer/0,,35bafb81f59d40399e75743ac9b04d7b_0,,99-1000,99-1000,Active,ArcGIS Hub,,Public,,FALSE,FALSE
,MDOT SHA Roadway Maintenance Responsibility,"Esri ArcGIS Online (AGOL) Hosted Feature Layer for accessing the MDOT SHA Roadway Maintenance Responsibility data product.MDOT SHA Roadway Maintenance Responsibility data consists of linear geometric features which indicate the government agencies responsible for maintaining each roadway throughout the State of Maryland. MDOT SHA Roadway Maintenance Responsibility data is primarily used for general planning and road maintenance coordination purposes, and for Federal Highway Administration (FHWA) Highway Performance Monitoring System (HPMS) annual submission & coordination. The Maryland Department of Transportation State Highway Administration (MDOT SHA) currently reports this data only on the inventory direction (generally North or East) side of the roadway. MDOT SHA Roadway Maintenance Responsibility data is not a complete representation of all roadway geometry. MDOT SHA Roadway Maintenance Responsibility data is developed as part of the Highway Performance Monitoring System (HPMS) which maintains and reports transportation related information to the Federal Highway Administration (FHWA) on an annual basis. HPMS is maintained by the Maryland Department of Transportation State Highway Administration (MDOT SHA), under the Office of Planning and Preliminary Engineering (OPPE) Data Services Division (DSD). MDOT SHA Roadway Maintenance Responsibility data is used by various business units throughout MDOT, as well as many other Federal, State and local government agencies. MDOT SHA Roadway Maintenance Responsibility data is key to understanding which government agenciesare responsible for maintaining each roadway throughout the State of Maryland. MDOT SHA Roadway Maintenance Responsibility data is updated & published on an annual basis for the prior year. This data is for the year 2019. Last Updated: August 2020 (08/01/2020),For more information, contact MDOT SHA OIT Enterprise Information Services:Email:GIS@mdot.maryland.gov",English,ArcGIS Online for Maryland,State of Maryland,Geospatial data,,RoadwayMaintenanceResponsibility|GovernmentControl|GovtControl|Maintenance|HighwayMaintenance|RoadwayMaintenance|MaintenanceResponsibility|HighwayPerformanceMonitoringSystem|HPMS|KnowYourRoads|Federal|State|Transportation|Statewide|Maryland|MD|MarylandDepartmentofTransportation|MDOT|MarylandDepartmentofTransportationStateHighwayAdministration|MDOTSHA|StateHighwayAdministration|SHA|OfficeofPlanning&PreliminaryEngineering|OPPE|DataServicesDivision|DSD|Vector|Dynamic|WFS|WMS|KML|2019,2020-11-14T04:59:55.000Z,,,,Maryland,"['-79.4433', '37.9363', '-75.0149', '39.7300']",Dataset|Service,Vector,Shapefile,https://data.imap.maryland.gov/datasets/2adbd3a6befc4112a80ffc11af716af2_0,https://data.imap.maryland.gov/datasets/2adbd3a6befc4112a80ffc11af716af2_0.zip,,https://services.arcgis.com/njFNhDsUCentVYJW/arcgis/rest/services/MDOT_SHA_Roadway_Maintenance_Responsibility/FeatureServer/0,,2adbd3a6befc4112a80ffc11af716af2_0,Maryland,04a-01,04a-01,Active,ArcGIS Hub,,Public,,FALSE,FALSE
,MDOT SHA Roadway Access Control,"Esri ArcGIS Online Hosted Feature Layer for accessing the MDOT SHA Roadway Access Control data product.MDOT SHA Roadway Access Control data consists of linear geometric features which showcase the types of control over vehicle access to roadways throughout the State of Maryland. Roadway Access Control data is commonly classified by three (3) control types, which are Full Access Control, Partial Access Control, and No Access Control. Roadway Access Control data is primarily used for general planning purposes, investment requirements modeling to calculate capacity and estimate type of design, in truck size and weight studies, and for Federal Highway Administration (FHWA) Highway Performance Monitoring System (HPMS) annual submission & coordination. The Maryland Department of Transportation State Highway Administration (MDOT SHA) currently reports this data only on the inventory direction (generally North or East) side of the roadway. Roadway Access Control data is not a complete representation of all roadway geometry.MDOT SHA Roadway Access Control data is developed as part of the Highway Performance Monitoring System (HPMS) which maintains and reports transportation related information to the Federal Highway Administration (FHWA) on an annual basis. HPMS is maintained by the Maryland Department of Transportation State Highway Administration (MDOT SHA), under the Office of Planning & Preliminary Engineering (OPPE) Data Services Division (DSD). Roadway Access Control data is used by various business units throughout MDOT, as well as many other Federal, State and local government agencies. Roadway Access Control data is key to understanding the types of control over vehicle access to roadways throughout the State of Maryland.MDOT SHA Roadway Access Control data is updated & published on an annual basis for the prior year. This data is for the year 2019.Last Updated: August 2020 (08/01/2020),For more information, contact MDOT SHA OIT Enterprise Information Services:Email:GIS@mdot.maryland.gov",English,ArcGIS Online for Maryland,State of Maryland,Geospatial data,,RoadwayAccessControl|Access|AccessControl|AccessType|AccessControlType|HighwayPerformanceMonitoringSystem|HPMS|RoadwayAccess|VehicleAccess|RoadwayVehicleAccess|Federal|State|Transportation|Statewide|Maryland|MD|FederalHighwayAdministration|FHWA|MarylandDepartmentofTransportation|MDOT|MarylandDepartmentofTransportationStateHighwayAdministration|MDOTSHA|StateHighwayAdministration|SHA|OfficeofPlanning&PreliminaryEngineering|OPPE|DataServicesDivision|DSD|MDOTSHAOITEnterpriseInformationServices|MDiMAP|Vector|Dynamic|WFS|WMS|KML|TRAN|2019,2020-11-11T04:14:33.000Z,,,,Maryland,"['-79.4433', '37.9363', '-75.0149', '39.7300']",Dataset|Service,Vector,Shapefile,https://data.imap.maryland.gov/datasets/74df8ed145c749a5b8ec28f8eb5cb958_0,https://data.imap.maryland.gov/datasets/74df8ed145c749a5b8ec28f8eb5cb958_0.zip,,https://services.arcgis.com/njFNhDsUCentVYJW/arcgis/rest/services/MDOT_SHA_Roadway_Access_Control/FeatureServer/0,,74df8ed145c749a5b8ec28f8eb5cb958_0,Maryland,04a-01,04a-01,Active,ArcGIS Hub,,Public,,FALSE,FALSE
,MDOT SHA CHART Traffic Signal Issue,MDOT SHA CHART active traffic signal issuesMDOT SHA WebsiteContact Us,English,ArcGIS Online for Maryland,State of Maryland,Geospatial data,,CHART|Traffic|Signal|Issue|TrafficIncidents(CHART)|MarylandDepartmentofTransportation|MarylandDepartmentofTransportation(MDOT)|Maryland|MDSHA|MDOT|MDOTSHA|MDOTOpenDataPortal|LiveLayer,2020-11-02T12:33:31.000Z,,,,Maryland,"['-77.4092', '38.6078', '-76.2787', '39.6916']",Dataset|Service,Vector,Shapefile,https://data.imap.maryland.gov/datasets/7f742aed30964518922dcc80c5d7267d_0,https://data.imap.maryland.gov/datasets/7f742aed30964518922dcc80c5d7267d_0.zip,https://chartimap1.sha.maryland.gov/arcgis/rest/services/CHART/ActionEvents/MapServer/0,,,7f742aed30964518922dcc80c5d7267d_0,Maryland,04a-01,04a-01,Active,ArcGIS Hub,,Public,,FALSE,FALSE
,MDOT SHA Annual Average Daily Traffic (AADT) Locations,"Esri ArcGIS Online (AGOL) Hosted Feature Layer for accessing the MDOT SHA Annual Average Daily Traffic (AADT) data product.MDOT SHA Annual Average Daily Traffic (AADT) data consists of linear & point geometric features which represent geographic locations & segments of roadway showing traffic volume throughout the State of Maryland.Annual Average Daily Traffic (AADT) data is collected from over 8700 program count stations and 84 ATRs, located throughout Maryland. The quality control feature of the system allow data edit checks and validation for data from the 84 permanent, continuous automatic traffic recorders (ATRs) and short-term traffic counts. To date, four (4) ATRs have been removed from the ATR Program. Program count data is collected (both directions) at regular locations on either a three (3) year or six (6) year cycle depending on type of roadway. Growth Factors are applied to counts which were not taken during the current year and the counts are factored based on the past yearly growth of an associated ATR. Counters are placed for 48 hours on a Monday or Tuesday and are picked up that Thursday or Friday, respectively. The ATR and toll count data is collected on a continuous basis. Toll station data is provided by the Maryland Transportation Authority (MDTA). A special numeric code was added to the AADT numbers, starting in 2006, to identify the years when the count was actually taken. The last digit represents the number of years prior to the actual count. Where ""0"" represents the current year when data was collected (in 2014), ""1"" represents the count taken in 2013, ""2"" represents the count taken in 2012, ""3"" represents the count taken in 2011 and so forth.Annual Average Daily Traffic (AADT) data is a strategic resource for the Federal Highway Administration (FHWA), the Maryland Department of Transportation (MDOT), the Maryland Department of Transportation State Highway Administration (MDOT SHA), as well as many other State and local government agencies. The data is essential in the planning, design and operation of the statewide road system and the development and implementation of State highway improvement and safety programs. The MDOT SHA Traffic Monitoring System (TMS) is a product of the ISTEA Act of 1991, which required a traffic data program to effectively and efficiently meet MDOT SHA's long-term traffic data monitoring and reporting requirements.Annual Average Daily Traffic (AADT) data is updated and published on an annual basis for the prior year. This data is for the year 2019.Data Last Updated: May 2020 (05/21/2020)View the most current AADT data in theMDOT SHA Annual Average Daily Traffic (AADT) LocatorFor more information about the data, contact MDOT SHA Traffic Monitoring System (TMS):Email:TMS@mdot.maryland.govFor more information, contact MDOT SHA OIT Enterprise Information Services:Email:GIS@mdot.maryland.gov",English,ArcGIS Online for Maryland,State of Maryland,Geospatial data,,AnnualAverageDailyTraffic|AADT|AnnualAverageWeekdayTraffic|AAWDT|Traffic|TrafficVolume|TrafficCounts|TrafficTrends|TrafficHistory|HistoricalTraffic|HistoricAADT|MotorcycleAADT|CarAADT|BusAADT|LightTruckAADT|TruckAADT|KFactor|DFactor|Transportation|Statewide|Maryland|MD|MarylandDepartmentofTransportation|MDOT|MarylandDepartmentofTransportationStateHighwayAdministration|MDOTSHA|StateHighwayAdministration|SHA|OfficeofPlanningandPreliminaryEngineering|OPPE|DataServicesDivision|DSD|TrafficMonitoringSystem|TMS|MarylandTransportationAuthority|MDTA|MDiMAP|Vector|Dynamic|WFS|WMS|KML|TRAN|2019,2020-06-02T01:40:55.000Z,,,,Maryland,"['-79.4818', '37.9718', '-75.0525', '39.7219']",Dataset|Service,Vector,Shapefile,https://data.imap.maryland.gov/datasets/77010abe7558425997b4fcdab02e2b64_0,https://data.imap.maryland.gov/datasets/77010abe7558425997b4fcdab02e2b64_0.zip,,https://services.arcgis.com/njFNhDsUCentVYJW/arcgis/rest/services/MDOT_SHA_Annual_Average_Daily_Traffic/FeatureServer/0,,77010abe7558425997b4fcdab02e2b64_0,Maryland,04a-01,04a-01,Active,ArcGIS Hub,,Public,,FALSE,FALSE
,MDOT SHA Annual Average Daily Traffic (AADT) Segments,"Esri ArcGIS Online (AGOL) Hosted Feature Layer for accessing the MDOT SHA Annual Average Daily Traffic (AADT) data product.MDOT SHA Annual Average Daily Traffic (AADT) data consists of linear & point geometric features which represent geographic locations & segments of roadway showing traffic volume throughout the State of Maryland.Annual Average Daily Traffic (AADT) data is collected from over 8700 program count stations and 84 ATRs, located throughout Maryland. The quality control feature of the system allow data edit checks and validation for data from the 84 permanent, continuous automatic traffic recorders (ATRs) and short-term traffic counts. To date, four (4) ATRs have been removed from the ATR Program. Program count data is collected (both directions) at regular locations on either a three (3) year or six (6) year cycle depending on type of roadway. Growth Factors are applied to counts which were not taken during the current year and the counts are factored based on the past yearly growth of an associated ATR. Counters are placed for 48 hours on a Monday or Tuesday and are picked up that Thursday or Friday, respectively. The ATR and toll count data is collected on a continuous basis. Toll station data is provided by the Maryland Transportation Authority (MDTA). A special numeric code was added to the AADT numbers, starting in 2006, to identify the years when the count was actually taken. The last digit represents the number of years prior to the actual count. Where ""0"" represents the current year when data was collected (in 2014), ""1"" represents the count taken in 2013, ""2"" represents the count taken in 2012, ""3"" represents the count taken in 2011 and so forth.Annual Average Daily Traffic (AADT) data is a strategic resource for the Federal Highway Administration (FHWA), the Maryland Department of Transportation (MDOT), the Maryland Department of Transportation State Highway Administration (MDOT SHA), as well as many other State and local government agencies. The data is essential in the planning, design and operation of the statewide road system and the development and implementation of State highway improvement and safety programs. The MDOT SHA Traffic Monitoring System (TMS) is a product of the ISTEA Act of 1991, which required a traffic data program to effectively and efficiently meet MDOT SHA's long-term traffic data monitoring and reporting requirements.Annual Average Daily Traffic (AADT) data is updated and published on an annual basis for the prior year. This data is for the year 2019.Data Last Updated: May 2020 (05/21/2020)View the most current AADT data in theMDOT SHA Annual Average Daily Traffic (AADT) LocatorFor more information about the data, contact MDOT SHA Traffic Monitoring System (TMS):Email:TMS@mdot.maryland.govFor more information, contact MDOT SHA OIT Enterprise Information Services:Email:GIS@mdot.maryland.gov",English,ArcGIS Online for Maryland,State of Maryland,Geospatial data,,AnnualAverageDailyTraffic|AADT|AnnualAverageWeekdayTraffic|AAWDT|Traffic|TrafficVolume|TrafficCounts|TrafficTrends|TrafficHistory|HistoricalTraffic|HistoricAADT|MotorcycleAADT|CarAADT|BusAADT|LightTruckAADT|TruckAADT|KFactor|DFactor|Transportation|Statewide|Maryland|MD|MarylandDepartmentofTransportation|MDOT|MarylandDepartmentofTransportationStateHighwayAdministration|MDOTSHA|StateHighwayAdministration|SHA|OfficeofPlanningandPreliminaryEngineering|OPPE|DataServicesDivision|DSD|TrafficMonitoringSystem|TMS|MarylandTransportationAuthority|MDTA|MDiMAP|Vector|Dynamic|WFS|WMS|KML|TRAN|2019,2020-06-02T01:40:55.000Z,,,,Maryland,"['-79.4871', '37.9647', '-75.0524', '39.7230']",Dataset|Service,Vector,Shapefile,https://data.imap.maryland.gov/datasets/77010abe7558425997b4fcdab02e2b64_1,https://data.imap.maryland.gov/datasets/77010abe7558425997b4fcdab02e2b64_1.zip,,https://services.arcgis.com/njFNhDsUCentVYJW/arcgis/rest/services/MDOT_SHA_Annual_Average_Daily_Traffic/FeatureServer/1,,77010abe7558425997b4fcdab02e2b64_1,Maryland,04a-01,04a-01,Active,ArcGIS Hub,,Public,,FALSE,FALSE
,MDOT SHA Survey Control Points,"The MD State Highway Administration Survey Control Points represented in this layer are an internal product of the MDOT SHA Plats & Surveys Division, compiled from in-house and field-collected sources, and are categorized by datum and source.",English,ArcGIS Online for Maryland,State of Maryland,Geospatial data,,ohd|psd|sha|mdot|survey|control|controlpoints|gps,2019-11-08T19:52:59.000Z,,,,Maryland,"['-81.5292', '37.5773', '-74.9700', '41.3725']",Dataset|Service,Vector,Shapefile,https://data.imap.maryland.gov/datasets/96ace93c6f0e4c578ee41debbb0d3955_0,https://data.imap.maryland.gov/datasets/96ace93c6f0e4c578ee41debbb0d3955_0.zip,https://utility.arcgis.com/usrsvcs/servers/96ace93c6f0e4c578ee41debbb0d3955/rest/services/OHD_PSD/Survey_Control_Points_Maryland_MDOTSHA/MapServer/0,,,96ace93c6f0e4c578ee41debbb0d3955_0,Maryland,04a-01,04a-01,Active,ArcGIS Hub,,Public,,FALSE,FALSE
,Roadway SubBlock Intersection,"Roads and Highways manages intersections, however they are not singular points; RH creates a series of points - one for each intersecting road at that intersection. For DDOT, it is more useful to have a single intersection point representing the intersection. Through a custom DDOT script, the series of intersection points is reduced into a single representative point. For more information please visitDDOT's wiki page.",English,"City of Washington, DC","Washington, District of Columbia",Geospatial data,,roadway|roadwayhub|LRS|linearreferencing|DDOT,2020-11-17T17:43:27.000Z,,,,"Washington, District of Columbia|District of Columbia|Maryland|Virginia","['-77.1144', '38.8099', '-76.9094', '38.9953']",Dataset|Service,Vector,Shapefile,https://opendata.dc.gov/datasets/8d19868afb58423eb0477228d1dd72ab_159,https://opendata.dc.gov/datasets/8d19868afb58423eb0477228d1dd72ab_159.zip,https://maps2.dcgis.dc.gov/dcgis/rest/services/DCGIS_DATA/Transportation_WebMercator/MapServer/159,,,8d19868afb58423eb0477228d1dd72ab_159,Maryland,04c-01,04c-01,Active,ArcGIS Hub,,Public,,FALSE,FALSE
,Neighborhood Labels,"This dataset was created by the DC Office of Planning and provides a simplified representation of the neighborhoods of the District of Columbia. These boundaries are used by the Office of Planning to determine appropriate locations for placement of neighborhood names on maps. They do not reflect detailed boundary information, do not necessarily include all commonly-used neighborhood designations, do not match planimetric centerlines, and do not necessarily match Neighborhood Cluster boundaries. There is no formal set of standards that describes which neighborhoods are represented or where boundaries are placed. These informal boundaries are not appropriate for display, calculation, or reporting. Their only appropriate use is to guide the placement of text labels for DC's neighborhoods. This is an informal product used for internal mapping purposes only. It should be considered draft, will be subject to change on an irregular basis, and is not intended for publication. METADATA CONTENT IS IN PROCESS OF VALIDATION AND SUBJECT TO CHANGE.",English,D.C. Office of the Chief Technology Officer,"Washington, District of Columbia",Geospatial data,,Administrative|D.C.|DC|DCGIS|DCGIS|DistrictofColumbia|neighborhood|neighborhoodnames|Neighborhoods|political|residential|Washington|WashingtonDC,2015-06-04T18:16:57.000Z,,,,"Washington, District of Columbia|District of Columbia|Maryland|Virginia","['-77.1036', '38.8269', '-76.9173', '38.9918']",Dataset|Service,Vector,Shapefile,https://opendata.dc.gov/datasets/c4b0cd43d50949e98e57de9f22b455fc_35,https://opendata.dc.gov/datasets/c4b0cd43d50949e98e57de9f22b455fc_35.zip,https://maps2.dcgis.dc.gov/dcgis/rest/services/DCGIS_DATA/Administrative_Other_Boundaries_WebMercator/MapServer/35,,,c4b0cd43d50949e98e57de9f22b455fc_35,Maryland,04c-01,04c-01,Active,ArcGIS Hub,,Public,,FALSE,FALSE
