identifier,code,title,alternativeTitle,description,genre,subject,format,type,geometryType,dateIssued,temporalCoverage,Date,spatialCoverage,spatial,provenance,publisher,creator,landingPage,downloadURL,webService,metadataURL,serverType,keywords
bfc18b7c15fa43ef89658bf884287099,08b-42029,Steep Slopes,,Areas of steep slope (percent) that fall within 2 categories: 1) Moderate (15-24%) and 2) Steep (greater than 25%) slopes within Chester County. The slope information is derived from a digital elevation terrain (DEM) that was created using Year 2000 elevation data.Steep Slopes were generated from a DEM created for Chester County by BAE Systems ADR (ADR),error,,error,error,,2016-11-03T16:01:34.000Z,,,"Chester County, Pennsylvania|Pennsylvania","-180.0,-90.0,180.0,90.0",Penn State,"Chester County, Pennsylvania","Chester County, PA",http://data1-chesco.opendata.arcgis.com/datasets/bfc18b7c15fa43ef89658bf884287099,error,,,,ccpc
113f6c046dfc4f159fb10bf5f637caab_19,08b-42029,Total Population,,"2010 Total Population by Municipality, for Chester County. ?Provided by the U.S. Census Bureau, 2010 Census.http://www.landscapes2.org/mapping/CountyProfiles/popTotal.cfm",error,,error,Dataset|Service,,2016-05-16T19:06:07.000Z,,,"Chester County, Pennsylvania|Pennsylvania","-76.1367,39.7078,-75.3549,40.2525",Penn State,"Chester County, Pennsylvania","Chester County, PA",http://data1-chesco.opendata.arcgis.com/datasets/113f6c046dfc4f159fb10bf5f637caab_19,error,https://gisprodops.chesco.org/arcgis/rest/services/Planning_Services/Plan_CP_AGOL_D/MapServer/19,,MapServer,chester county|planning|county profiles
8b6c70f6779246f9af1b9399e292a041_0,08b-42029,Polling Places,,"Locations where ballots can be cast on election day in Chester County, PA",error,,error,Dataset|Service,,2016-02-25T20:15:30.000Z,,,"Chester County, Pennsylvania|Pennsylvania","-76.13663471543657,39.707859150275546,-75.35489995962918,40.252090280792245",Penn State,"Chester County, Pennsylvania","Chester County, PA",http://data1-chesco.opendata.arcgis.com/datasets/8b6c70f6779246f9af1b9399e292a041_0,error,https://services.arcgis.com/G4S1dGvn7PIgYd6Y/arcgis/rest/services/ElectionPollingPlaces/FeatureServer/0,,FeatureServer,Election|Election Polling Places|Precincts|Voting
8b6c70f6779246f9af1b9399e292a041_1,08b-42029,Voting Precincts,,"Locations where ballots can be cast on election day in Chester County, PA",error,,error,Dataset|Service,,2016-02-25T20:15:30.000Z,,,"Chester County, Pennsylvania|Pennsylvania","-76.13663471543657,39.707859150275546,-75.35489995962918,40.252090280792245",Penn State,"Chester County, Pennsylvania","Chester County, PA",http://data1-chesco.opendata.arcgis.com/datasets/8b6c70f6779246f9af1b9399e292a041_1,error,https://services.arcgis.com/G4S1dGvn7PIgYd6Y/arcgis/rest/services/ElectionPollingPlaces/FeatureServer/1,,FeatureServer,Election|Election Polling Places|Precincts|Voting
266ed868f4994249994d6c5daa9b9843_10,08b-42029,Livable Landscapes,,"On November 9th, the Chester County Board of Commissioners adopted Landscapes2 as the official long range policy plan for Chester County. This GIS Dataset is a representation of the Landscapes identified in the plan. The concept of livable landscapes provides a framework for protection and growth strategies within Chester County. The map provides a guide for accommodating expected future growth while maintaining the quality of life in the county. The Livable Landscapes map is divided into two core areas, growth areas and rural resource areas, as prescribed by the Pennsylvania Municipalities Planning Code. The growth areas consist of the urban landscape and the suburban landscape. The rural resource areas consist of the agricultural landscape and the rural landscape. The natural landscape exists throughout the county recognizing the important network of natural resources needing specific protection. Livable landscapes recognizes the diversity that makes Chester County a special place. Each landscape has a different character and is appropriate for different intensities and varieties of development. The urban and suburban landscapes can best accommodate future growth. The county will encourage future development to be concentrated in these landscapes. The rural and agricultural landscapes are least appropriate for intense growth. The county will not encourage development in these landscapes. Livable landscapes is not a land use map. Any land use can be found in each of the landscapes, but the mix and intensity of land uses will be different to preserve the character of each landscape.",error,,error,Dataset|Service,,2016-05-11T19:01:24.000Z,,,"Chester County, Pennsylvania|Pennsylvania","-76.1367,39.7079,-75.3549,40.2525",Penn State,"Chester County, Pennsylvania","Chester County, PA",http://data1-chesco.opendata.arcgis.com/datasets/266ed868f4994249994d6c5daa9b9843_10,error,https://gisprodops.chesco.org/arcgis/rest/services/Planning_Services/Plan_Landscapes_D/MapServer/10,,MapServer,ccpc
93ea24bc9a854e2e9c54491921da5cd6_0,08b-42029,Surfaced Trails,,"The definition of an Existing Surfaced Trail is as follows: Any trail that is constructed with improved surface materials (i.e. concrete, asphalt, brick, gravel, cinders, wood, and mulch) and are accessible to the public. Excluded from this designation are existing trail alignments that have a dirt or grass surface.",error,,error,Dataset|Service,,2015-06-25T14:46:20.000Z,,,"Chester County, Pennsylvania|Pennsylvania","-76.04908821972393,39.73491988817006,-75.39481653154148,40.23712843682862",Penn State,"Chester County, Pennsylvania","Chester County, PA",http://data1-chesco.opendata.arcgis.com/datasets/93ea24bc9a854e2e9c54491921da5cd6_0,error,https://services.arcgis.com/G4S1dGvn7PIgYd6Y/arcgis/rest/services/Surfaced_Trails/FeatureServer/0,,FeatureServer,trails| Chester County
053eb2545cff4487b515602cb6b289cf_0,08b-42029,FEMA 100 Year Flood Zones,,"The FEMA 100 Year Flood Zones layer contains flood zone values A, AE and AO.??This data layer is FEMA's official National Flood Hazard Layer for Chester County.??The effective date is?9/29/2017.",error,,error,Dataset|Service,,2017-04-24T14:38:07.000Z,,,"Chester County, Pennsylvania|Pennsylvania","-76.13671823793571,39.72163478237553,-75.354817203718,40.23935405264071",Penn State,"Chester County, Pennsylvania","Chester County, PA",http://data1-chesco.opendata.arcgis.com/datasets/053eb2545cff4487b515602cb6b289cf_0,error,https://services.arcgis.com/G4S1dGvn7PIgYd6Y/arcgis/rest/services/FEMA_100_Year_Flood_Zones/FeatureServer/0,,FeatureServer,Chester County| FEMA| Floodplains
10faf474173f4b3ebc872adb2fc9ce32_6,08b-42029,Traffic Volumes,,"PennDOT traffic volume estimates compiled by Chester County Planning Commission, as of 2012",error,,error,Dataset|Service,,2016-05-11T18:58:54.000Z,,,"Chester County, Pennsylvania|Pennsylvania","-76.0648,39.7102,-75.3668,40.2492",Penn State,"Chester County, Pennsylvania","Chester County, PA",http://data1-chesco.opendata.arcgis.com/datasets/10faf474173f4b3ebc872adb2fc9ce32_6,error,https://gisprodops.chesco.org/arcgis/rest/services/Planning_Services/Plan_CP_AGOL_D/MapServer/6,,MapServer,ccpc
0298f5eb5a144ca0aca338ef5d831642_0,08b-42029,TII Lines,,"The Transportation Improvements Inventory (TII) is a comprehensive record of documented transportation needs within Chester County. It includes proposed roadway, bridge, bicycle and pedestrian, freight and transit projects that have been recommended to the Chester County Planning Commission by municipalities and other stakeholders over time. Although the TII listing does not represent programming or funding commitments, it recognizes transportation priorities and emphasizes the need for additional technical and financial resource to implement critical transportation improvements.",error,,error,Dataset|Service,,2016-05-16T13:52:42.000Z,,,"Chester County, Pennsylvania|Pennsylvania","-76.06476262946202,39.71046996489392,-75.380066954804,40.255540593781056",Penn State,"Chester County, Pennsylvania","Chester County, PA",http://data1-chesco.opendata.arcgis.com/datasets/0298f5eb5a144ca0aca338ef5d831642_0,error,https://services.arcgis.com/G4S1dGvn7PIgYd6Y/arcgis/rest/services/TII_Lines/FeatureServer/0,,FeatureServer,ccpc
bfc3c5f751fe4e93902e4504021ecb59_0,08b-42029,TII Points,,"The Transportation Improvements Inventory (TII) is a comprehensive record of documented transportation needs within Chester County. It includes proposed roadway, bridge, bicycle and pedestrian, freight and transit projects that have been recommended to the Chester County Planning Commission by municipalities and other stakeholders over time. Although the TII listing does not represent programming or funding commitments, it recognizes transportation priorities and emphasizes the need for additional technical and financial resource to implement critical transportation improvements.",error,,error,Dataset|Service,,2016-05-16T13:54:40.000Z,,,"Chester County, Pennsylvania|Pennsylvania","-76.02582775429167,39.72049154105127,-75.41241050398473,40.248254732082145",Penn State,"Chester County, Pennsylvania","Chester County, PA",http://data1-chesco.opendata.arcgis.com/datasets/bfc3c5f751fe4e93902e4504021ecb59_0,error,https://services.arcgis.com/G4S1dGvn7PIgYd6Y/arcgis/rest/services/TII_Points/FeatureServer/0,,FeatureServer,ccpc
c9c268fd81e84f53aed08121f2301aa1_18,08b-42029,Population Projections,,"Population Projections by municipality, for Chester County. ?Provided by DVRPC, 2012.http://www.landscapes2.org/mapping/CountyProfiles/popProj.cfm",error,,error,Dataset|Service,,2016-05-16T19:06:00.000Z,,,"Chester County, Pennsylvania|Pennsylvania","-76.1367,39.7078,-75.3549,40.2525",Penn State,"Chester County, Pennsylvania","Chester County, PA",http://data1-chesco.opendata.arcgis.com/datasets/c9c268fd81e84f53aed08121f2301aa1_18,error,https://gisprodops.chesco.org/arcgis/rest/services/Planning_Services/Plan_CP_AGOL_D/MapServer/18,,MapServer,ccpc
47617fcb74a14a6c8844a920fe81491c_0,08b-42029,Municipal Boundary,,Regional Municipal Boundary,error,,error,Dataset|Service,,2014-03-11T15:26:09.000Z,,,"Chester County, Pennsylvania|Pennsylvania","-77.14450137086156,39.261907085276135,-74.3385425421922,40.64187516533279",Penn State,"Chester County, Pennsylvania","Chester County, PA",http://data1-chesco.opendata.arcgis.com/datasets/47617fcb74a14a6c8844a920fe81491c_0,error,https://services.arcgis.com/G4S1dGvn7PIgYd6Y/arcgis/rest/services/Municipal_Boundary/FeatureServer/0,,FeatureServer,Boundary|Chesco|Chester|Chester County|Municipal|Regional
743f6f125f1e41589c0c9841d65a0ade_0,08b-42029,Parcels,,Chester County tax parcels,error,,error,Dataset|Service,,2016-04-12T15:09:36.000Z,,,"Chester County, Pennsylvania|Pennsylvania","-76.13663542411803,39.70785912678018,-75.35490008645371,40.25209031364323",Penn State,"Chester County, Pennsylvania","Chester County, PA",http://data1-chesco.opendata.arcgis.com/datasets/743f6f125f1e41589c0c9841d65a0ade_0,error,https://services.arcgis.com/G4S1dGvn7PIgYd6Y/arcgis/rest/services/Parcels_owners/FeatureServer/0,,FeatureServer,chester county|cadastral|Chester County|parcels
d43c3672eef54e0fa6fbc388ebb2a6ed_0,08b-42029,Railroad Lines,,"This data represents the railroad centerlines for Chester County.  The railroad centerlines data layer was originally based on aerial photographs taken April 7, 1993.  Updates to the layer have been made based on additional research and aerial photograph taken in spring 2000.",error,,error,Dataset|Service,,2015-06-23T18:29:46.000Z,,,"Chester County, Pennsylvania|Pennsylvania","-76.02905565720428,39.72107941740442,-75.3800669545977,40.24368806328749",Penn State,"Chester County, Pennsylvania","Chester County, PA",http://data1-chesco.opendata.arcgis.com/datasets/d43c3672eef54e0fa6fbc388ebb2a6ed_0,error,https://services.arcgis.com/G4S1dGvn7PIgYd6Y/arcgis/rest/services/Railroad_Lines/FeatureServer/0,,FeatureServer,Chester County|parks
b195a2fbfdc546baa9fe35366705e628_40,08b-42029,Schools,,"This data set contains locational and attribute information for schools, this includes: Public, Private, Parochial, Charitable, Vocational or any other institution intended for teaching from kindergarten to twelfth grade in Chester County, Pa.",error,,error,Dataset|Service,,2016-05-11T19:00:09.000Z,,,"Chester County, Pennsylvania|Pennsylvania","-76.0052,39.7362,-75.3856,40.2374",Penn State,"Chester County, Pennsylvania","Chester County, PA",http://data1-chesco.opendata.arcgis.com/datasets/b195a2fbfdc546baa9fe35366705e628_40,error,https://gisprodops.chesco.org/arcgis/rest/services/Planning_Services/Plan_CP_AGOL_D/MapServer/40,,MapServer,ccpc
ffeef32123e7488ba91f2ea196bbaa84,08b-42029,Chester County MS4 Base GIS Map Package,,"This is a map package to assist Chester County MS4 municipalities with developing stormwater management GIS files. A map package contains a map document (.mxd) and the data referenced by the layers it contains, packaged into one convenient file.VERY LARGE FILE ?- ?APPROX 1.7 GB!This file will take a long time to download. Once downloaded, it also takes a long time to open the first time.? The map package is located at:?ftp://gisftp.chesco.org/ccpc/CCWRA/GIS_Open_Data/MS4_BaseGISData_11212016.mpk",error,,error,error,,2016-11-21T20:36:55.000Z,,,"Chester County, Pennsylvania|Pennsylvania","-180.0,-90.0,180.0,90.0",Penn State,"Chester County, Pennsylvania","Chester County, PA",http://data1-chesco.opendata.arcgis.com/datasets/ffeef32123e7488ba91f2ea196bbaa84,error,,,,water quality
3b6625b2453a481f98111c25432d0c3c_0,08b-42029,Address Data Points,,Each point refers to a single location address.  Parcels with multiple addresses will have multiple points.,error,,error,Dataset|Service,,2016-01-11T13:12:20.000Z,,,"Chester County, Pennsylvania|Pennsylvania","-76.13090042214412,39.708589146802964,-75.35554933730155,40.25067808518105",Penn State,"Chester County, Pennsylvania","Chester County, PA",http://data1-chesco.opendata.arcgis.com/datasets/3b6625b2453a481f98111c25432d0c3c_0,error,https://services.arcgis.com/G4S1dGvn7PIgYd6Y/arcgis/rest/services/Address_Data_Points/FeatureServer/0,,FeatureServer,Addresses|Chester County|parcels
576526427b6246df945d1904a358697c_0,08b-42029,Traffic Signals,,"Traffic signal locations in Chester County, PA.",error,,error,Dataset|Service,,2016-05-16T18:55:28.000Z,,,"Chester County, Pennsylvania|Pennsylvania","-76.02194838722276,39.7386360903513,-75.38548012345416,40.24727580390308",Penn State,"Chester County, Pennsylvania","Chester County, PA",http://data1-chesco.opendata.arcgis.com/datasets/576526427b6246df945d1904a358697c_0,error,https://services.arcgis.com/G4S1dGvn7PIgYd6Y/arcgis/rest/services/Traffic_Signals/FeatureServer/0,,FeatureServer,ccpc
0e728b7df59c40d9a8160ee8cb9cbd1c_0,08b-42029,2010UrbanizedAreasAroundChesterCountyPA,,"Metadata: Review and/or download a?3-page metadata document?(.pdf format) from the CCWRA web site.Description from CCWRA (June 2015): This GIS file is a subset of the Census 2010 Urbanized Area, limited to the boundaries of Chester County, PA. The original data contained Urban Clusters, which were removed. The data was given a projected coordinate system, but no other changes have been made to the original source data. The source data was downloaded in May 2015 from the following website:?http://www.census.gov/geo/reference/ua/urban-rural-2010.html?Description from US Census Bureau:The TIGER/Line Files are shapefiles and related database files (.dbf) that are an extract of selected geographic and cartographic information from the U.S. Census Bureau's Master Address File / Topologically Integrated Geographic Encoding and Referencing (MAF/TIGER) Database (MTDB). The MTDB represents a seamless national file with no overlaps or gaps between parts, however, each TIGER/Line File is designed to stand alone as an independent data set, or they can be combined to cover the entire nation.?After each decennial census, the Census Bureau delineates urban areas that represent densely developed territory, encompassing residential, commercial, and other nonresidential urban land uses. In general, this territory consists of areas of high population density and urban land use resulting in a representation of the urban footprint. There are two types of urban areas: urbanized areas (UAs) that contain 50,000 or more people and urban clusters (UCs) that contain at least 2,500 people, but fewer than 50,000 people (except in the U.S. Virgin Islands and Guam which each contain urban clusters with populations greater than 50,000). Each urban area is identified by a 5-character numeric census code that may contain leading zeroes.How should this data set be cited??? U.S. Department of Commerce, U.S. Census Bureau, 2015.?",error,,error,Dataset|Service,,2015-06-23T13:40:26.000Z,,,"Chester County, Pennsylvania|Pennsylvania","-76.6869339695831,39.50489458735382,-74.6262181246856,40.55836703841975",Penn State,"Chester County, Pennsylvania","Chester County, PA",http://data1-chesco.opendata.arcgis.com/datasets/0e728b7df59c40d9a8160ee8cb9cbd1c_0,error,https://services.arcgis.com/G4S1dGvn7PIgYd6Y/arcgis/rest/services/2010UrbanizedAreasAroundChesterCountyPA/FeatureServer/0,,FeatureServer,Urbanized Area
c2bb8a39e7534fc6a3ea2fa13df9f9d4_0,08b-42029,Park and Ride,,Park and Ride locations in and around Chester County provided by PennDOT.,error,,error,Dataset|Service,,2016-05-11T18:58:40.000Z,,,"Chester County, Pennsylvania|Pennsylvania","-76.0252,39.7303,-75.3128,40.224",Penn State,"Chester County, Pennsylvania","Chester County, PA",http://data1-chesco.opendata.arcgis.com/datasets/c2bb8a39e7534fc6a3ea2fa13df9f9d4_0,error,https://gisprodops.chesco.org/arcgis/rest/services/Planning_Services/Plan_CP_AGOL_D/MapServer/0,,MapServer,ccpc
ad2bd0963e234fa7b5cf7833323e4443_33,08b-42029,Job Forecasts,,"Job forecast estimates for 2020, 2030, and 2040 in Chester County. ?Provided by DVRPC, 2012.http://www.landscapes2.org/mapping/CountyProfiles/ecoJobs.cfm",error,,error,Dataset|Service,,2016-05-16T19:05:46.000Z,,,"Chester County, Pennsylvania|Pennsylvania","-76.1367,39.7078,-75.3549,40.2525",Penn State,"Chester County, Pennsylvania","Chester County, PA",http://data1-chesco.opendata.arcgis.com/datasets/ad2bd0963e234fa7b5cf7833323e4443_33,error,https://gisprodops.chesco.org/arcgis/rest/services/Planning_Services/Plan_CP_AGOL_D/MapServer/33,,MapServer,chester county|planning|county profiles|transportation
98861f4883634b28a2dbe95e41f6deaf_0,08b-42029,ZipCodes,,"ZIP Codes for Chester County.??Clipped from ESRI USA Zip Code Areas. Zip code boundaries are from March 2017, modified 4/11/2018.??ZIP Code Areas (Five-Digit) represents five-digit ZIP Code areas used by the U.S. Postal Service to deliver mail more effectively. The first digit of a five-digit ZIP Code divides the United States into 10 large groups of states numbered from 0 in the Northeast to 9 in the far West. Within these areas, each state is divided into an average of 10 smaller geographical areas, identified by the second and third digits. These digits, in conjunction with the first digit, represent a sectional center facility or a mail processing facility area. The fourth and fifth digits identify a post office, station, branch or local delivery area.",error,,error,Dataset|Service,,2018-09-25T15:56:30.000Z,,,"Chester County, Pennsylvania|Pennsylvania","-76.14801411293358,39.721759274117794,-75.32076317492249,40.238353315669876",Penn State,"Chester County, Pennsylvania","Chester County, PA",http://data1-chesco.opendata.arcgis.com/datasets/98861f4883634b28a2dbe95e41f6deaf_0,error,https://services.arcgis.com/G4S1dGvn7PIgYd6Y/arcgis/rest/services/ZipCodes/FeatureServer/0,,FeatureServer,   Chester County| Boundaries
0c9b0a0bf62e4fed9423434c309497b1_5,08b-42029,Historic Rails,,?Historic Railroads in Chester County. ?The historic railroads data layer represents rail lines that have been abandoned and no longer exist. There are two types of abandonment: abandoned right of way and abandoned ownership.,error,,error,Dataset|Service,,2016-05-11T18:58:35.000Z,,,"Chester County, Pennsylvania|Pennsylvania","-75.995,39.9253,-75.3984,40.0599",Penn State,"Chester County, Pennsylvania","Chester County, PA",http://data1-chesco.opendata.arcgis.com/datasets/0c9b0a0bf62e4fed9423434c309497b1_5,error,https://gisprodops.chesco.org/arcgis/rest/services/Planning_Services/Plan_CP_AGOL_D/MapServer/5,,MapServer,ccpc
9b0535a215314ab68b2bb326017c9509_2,08b-42029,Police Territory Fill,,Police Response Territory,error,,error,Dataset|Service,,2015-05-01T15:26:54.000Z,,,"Chester County, Pennsylvania|Pennsylvania","-76.73297993058634,39.30494784071125,-74.99422429040021,40.65932810190816",Penn State,"Chester County, Pennsylvania","Chester County, PA",http://data1-chesco.opendata.arcgis.com/datasets/9b0535a215314ab68b2bb326017c9509_2,error,https://services.arcgis.com/G4S1dGvn7PIgYd6Y/arcgis/rest/services/Police_Response_Territory/FeatureServer/2,,FeatureServer,Chester County|   Response|   CCDES|   Police|   Law|   Territory|   Public Safety
9b0535a215314ab68b2bb326017c9509_1,08b-42029,Police Territory Outline,,Police Response Territory,error,,error,Dataset|Service,,2015-05-01T15:26:54.000Z,,,"Chester County, Pennsylvania|Pennsylvania","-76.73297993058634,39.30494784071125,-74.99422429040021,40.65932810190816",Penn State,"Chester County, Pennsylvania","Chester County, PA",http://data1-chesco.opendata.arcgis.com/datasets/9b0535a215314ab68b2bb326017c9509_1,error,https://services.arcgis.com/G4S1dGvn7PIgYd6Y/arcgis/rest/services/Police_Response_Territory/FeatureServer/1,,FeatureServer,Chester County|   Response|   CCDES|   Police|   Law|   Territory|   Public Safety
ffb0339350ad4a19a10d7e8b6efd5c68_0,08b-42029,County Boundary,,Regional County Boundary,error,,error,Dataset|Service,,2014-03-11T15:23:17.000Z,,,"Chester County, Pennsylvania|Pennsylvania","-77.14496015573756,39.2098510452047,-74.3385425422235,40.641875165356964",Penn State,"Chester County, Pennsylvania","Chester County, PA",http://data1-chesco.opendata.arcgis.com/datasets/ffb0339350ad4a19a10d7e8b6efd5c68_0,error,https://services.arcgis.com/G4S1dGvn7PIgYd6Y/arcgis/rest/services/CountyBoundary/FeatureServer/0,,FeatureServer,Boundary|Chesco|Chester|Chester County|Regional
2265217a28c043aeb813a07039a60674_0,08b-42029,Fire Response Territory,,Emergency Service Zones(ESZ)used by Chester County Department of Emergency Services,error,,error,Dataset|Service,,2016-02-03T20:48:50.000Z,,,"Chester County, Pennsylvania|Pennsylvania","-76.73297993058634,39.27741421842665,-74.99422429040021,40.687426448613806",Penn State,"Chester County, Pennsylvania","Chester County, PA",http://data1-chesco.opendata.arcgis.com/datasets/2265217a28c043aeb813a07039a60674_0,error,https://services.arcgis.com/G4S1dGvn7PIgYd6Y/arcgis/rest/services/Fire_Response_Territory/FeatureServer/0,,FeatureServer,Fire|      Response|      ESZ|      Boxes|      DES|      EOC
2265217a28c043aeb813a07039a60674_1,08b-42029,Fire Response Box,,Emergency Service Zones(ESZ)used by Chester County Department of Emergency Services,error,,error,Dataset|Service,,2016-02-03T20:48:50.000Z,,,"Chester County, Pennsylvania|Pennsylvania","-76.73297993058634,39.27741421842665,-74.99422429040021,40.687426448613806",Penn State,"Chester County, Pennsylvania","Chester County, PA",http://data1-chesco.opendata.arcgis.com/datasets/2265217a28c043aeb813a07039a60674_1,error,https://services.arcgis.com/G4S1dGvn7PIgYd6Y/arcgis/rest/services/Fire_Response_Territory/FeatureServer/1,,FeatureServer,Fire|      Response|      ESZ|      Boxes|      DES|      EOC
394fecd305a44e94b38a0c41e4ae439d_0,08b-42029,Sidewalks,,"Existing Sidewalks in Chester County, as of May 2016",error,,error,Dataset|Service,,2016-05-13T14:26:11.000Z,,,"Chester County, Pennsylvania|Pennsylvania","-75.99650049944472,39.742420274192106,-75.38079780407766,40.24768255861063",Penn State,"Chester County, Pennsylvania","Chester County, PA",http://data1-chesco.opendata.arcgis.com/datasets/394fecd305a44e94b38a0c41e4ae439d_0,error,https://services.arcgis.com/G4S1dGvn7PIgYd6Y/arcgis/rest/services/Sidewalks/FeatureServer/0,,FeatureServer,ccpc
60e0672bfaa34ab599cbff96bd85ffcb_0,08b-42029,Municipal Recreation,,"Parcels of land, including trails that are owned in-fee by a municipality and are currently open to the public for recreation.",error,,error,Dataset|Service,,2015-06-23T17:46:37.000Z,,,"Chester County, Pennsylvania|Pennsylvania","-76.011292801533,39.74320589277746,-75.38038552548242,40.237991324606604",Penn State,"Chester County, Pennsylvania","Chester County, PA",http://data1-chesco.opendata.arcgis.com/datasets/60e0672bfaa34ab599cbff96bd85ffcb_0,error,https://services.arcgis.com/G4S1dGvn7PIgYd6Y/arcgis/rest/services/Municipal_Recreation/FeatureServer/0,,FeatureServer,Chester County|   parks
c489c1f02ee8426e92682454c32c7753_1,08b-42029,Rail Stations,,This point data layer represents Railroad Stations located in Chester County provided by SEPTA and Amtrak,error,,error,Dataset|Service,,2016-05-11T18:58:44.000Z,,,"Chester County, Pennsylvania|Pennsylvania","-75.922,39.9509,-75.4036,40.059",Penn State,"Chester County, Pennsylvania","Chester County, PA",http://data1-chesco.opendata.arcgis.com/datasets/c489c1f02ee8426e92682454c32c7753_1,error,https://gisprodops.chesco.org/arcgis/rest/services/Planning_Services/Plan_CP_AGOL_D/MapServer/1,,MapServer,ccpc
2ee77bbe2e9e4680a3637b8e35094030_0,08b-42029,Chester County Road Centerlines,,Chester County road centerlines.,error,,error,Dataset|Service,,2016-01-11T15:38:06.000Z,,,"Chester County, Pennsylvania|Pennsylvania","-76.131605631321,39.70824083170331,-75.35629517118811,40.2501592293838",Penn State,"Chester County, Pennsylvania","Chester County, PA",http://data1-chesco.opendata.arcgis.com/datasets/2ee77bbe2e9e4680a3637b8e35094030_0,error,https://services.arcgis.com/G4S1dGvn7PIgYd6Y/arcgis/rest/services/Chesco_RDCL/FeatureServer/0,,FeatureServer,centerlines|Chester County|roads
