Title,Alternative Title,Description,Language,Creator,Publisher,Genre,Subject,Keyword,Date Issued,Temporal Coverage,Date Range,Solr Year,Spatial Coverage,Bounding Box,Type,Geometry Type,Format,Information,Download,MapServer,FeatureServer,ImageServer,Identifier,Provenance,Code,Is Part Of,Status,Accrual Method,Date Accessioned,Rights,Access Rights,Suppressed,Child
,Ozone National Ambient Air Quality Standard Nonattainment Areas - 2015 ,"The United States Environmental Protection Agency (USEPA) requires Michigan to attain the National Ambient Air Quality Standards (NAAQS) for six criteria pollutants. The data contained in this layer file outlines the statewide nonattainment areas for the 2015 Ozone NAAQS as designated by the USEPA. There are two partial and one full nonattainment counties located on the west side along Lake Michigan (i.e., Allegan, Berrien - full, and Muskegon), along with a seven-county area located in southeast Michigan. Further information about the six criteria pollutant NAAQS, including ozone can be found on EGLE Air Quality Division's SIP and Attainment webpage. ",English,"Michigan Dept. of Environment, Great Lakes, and Energy",State of Michigan,Geospatial data,,EGLE|AQD|Boundaries|Monitoring,2020-11-04T14:29:58.000Z,,,,Michigan,"['-86.8249', '41.7235', '-82.4135', '43.4725']",Dataset|Service,Vector,Shapefile,https://gis-michigan.opendata.arcgis.com/datasets/0b1a62103e494d428e193929ba6efefd_14,https://gis-michigan.opendata.arcgis.com/datasets/0b1a62103e494d428e193929ba6efefd_14.zip,https://gisago.mcgi.state.mi.us/arcgis/rest/services/EGLE/AirMonitoring/MapServer/14,,,0b1a62103e494d428e193929ba6efefd_14,Michigan State,06a-01,06a-01,Active,ArcGIS Hub,,Public,,FALSE,FALSE
,Michigan Prosperity Regions,"This layer outlines the 10 ""economic prosperity regions"" in Governor Snyder's Region Prosperity Initiative. The Regional Prosperity Initiative is comprised of two parts, an effort by the State of Michigan to align around a common set of service delivery boundaries to create a better structure for collaboration and a local voluntary grant initiative. This geographic delineation is based on county boundaries at the lowest level. Please see the MDOT Metadata Form for additional information.Update Cycle: Michigan RPI Boundaries are static boundaries.Coverage: This is the official boundary delineation for Governor Snyder's Region Prosperity Initiative (RPI).",English,Michigan Department of Transportation,State of Michigan,Geospatial data,,mi|michigan|mdot|transportation|opendata|boundaries|prosperity|rpi|regions,2017-02-09T17:03:48.000Z,,,,Michigan,"['-168.0733', '69.8346', '170.9904', '76.0537']",Dataset|Service,Vector,Shapefile,https://gis-michigan.opendata.arcgis.com/datasets/ae387365c550430ebbdc2c54b839030d_30,https://gis-michigan.opendata.arcgis.com/datasets/ae387365c550430ebbdc2c54b839030d_30.zip,https://gisago.mcgi.state.mi.us/arcgis/rest/services/MDOT/mdot_opendata/MapServer/30,,,ae387365c550430ebbdc2c54b839030d_30,Michigan State,06a-01,06a-01,Active,ArcGIS Hub,,Public,,FALSE,FALSE
,Brownfields,"The brownfield redevelopment data set contains information related to brownfield redevelopment incentives provided by the Michigan Department of Environment, Great Lakes and Energy (EGLE) to assist in the redevelopment of contaminated properties. EGLE provides brownfield assessments, grant and loan funding, and approves the use of certain taxes, to fund eligible environmental activities to safely prepare contaminated properties for reuse. The data set ranges from 1992 to present and contains information related to specific projects that were provided one or more incentives. More information about the Michigan brownfield redevelopment program can be found at: www.michigan.gov/eglebrownfields.",English,"Michigan Dept. of Environment, Great Lakes, and Energy",State of Michigan,Geospatial data,,EGLE|Remediation|Michigan,2020-11-09T15:13:05.000Z,,,,Michigan,"['-90.1703', '41.7994', '-82.4198', '47.2492']",Dataset|Service,Vector,Shapefile,https://gis-michigan.opendata.arcgis.com/datasets/8b28cef917b04d3fa4e75d650e06f431_0,https://gis-michigan.opendata.arcgis.com/datasets/8b28cef917b04d3fa4e75d650e06f431_0.zip,https://gisago.mcgi.state.mi.us/arcgis/rest/services/EGLE/BrownfieldsOpenData/MapServer/0,,,8b28cef917b04d3fa4e75d650e06f431_0,Michigan State,06a-01,06a-01,Active,ArcGIS Hub,,Public,,FALSE,FALSE
,Air Monitoring Sites  ,"The data contained in this layer file are representative of the current EGLE statewide air monitoring database. This monitoring network meets the United States Environmental Protection Agency's (USEPA) monitoring regulations. The layer contains location, site photographs, and defines the specific pollutants monitored for at that site. Overall the air monitoring network collects data for the six criteria pollutants outlined through the USEPA's National Ambient Air Quality Standards (i.e., carbon monoxide, lead, nitrogen dioxide, ozone, particulate pollution, and sulfur dioxide) along with several other pollutants, as relevant to each area. ",English,"Michigan Dept. of Environment, Great Lakes, and Energy",State of Michigan,Geospatial data,,EGLE|AQD|Monitoring,2020-10-26T17:42:02.000Z,,,,Michigan,"['-86.3111', '41.8956', '-82.4502', '46.2889']",Dataset|Service,Vector,Shapefile,https://gis-michigan.opendata.arcgis.com/datasets/04fb766b68704594945cc5948822161a_0,https://gis-michigan.opendata.arcgis.com/datasets/04fb766b68704594945cc5948822161a_0.zip,https://gisago.mcgi.state.mi.us/arcgis/rest/services/EGLE/AirMonitoring/MapServer/0,,,04fb766b68704594945cc5948822161a_0,Michigan State,06a-01,06a-01,Active,ArcGIS Hub,,Public,,FALSE,FALSE
,Treatment Storage Disposal Facilities - Part111,"This data set contains the Resource Conservation and Recovery Act Subtitle C facilities that managed hazardous wastes onsite, either by treatment, storage for longer than 90 days, and/or disposing those wastes onsite. This data is refreshed from the Waste Data Systems database (https://www.egle.state.mi.us/wdspi/Home.aspx) on a weekly basis.",English,"Michigan Dept. of Environment, Great Lakes, and Energy",State of Michigan,Geospatial data,,EGLE|RCRA|MMD|TSD|Treatment|Storage|Disposal|Remediation,2020-11-06T13:21:49.000Z,,,,Michigan,"['-88.0690', '41.7213', '-82.4516', '46.4478']",Dataset|Service,Vector,Shapefile,https://gis-michigan.opendata.arcgis.com/datasets/9a923b49b1824f45b27a58c37526fec9_0,https://gis-michigan.opendata.arcgis.com/datasets/9a923b49b1824f45b27a58c37526fec9_0.zip,https://gisago.mcgi.state.mi.us/arcgis/rest/services/EGLE/Part111TreatmentStorageDisposalFacilities/MapServer/0,,,9a923b49b1824f45b27a58c37526fec9_0,Michigan State,06a-01,06a-01,Active,ArcGIS Hub,,Public,,FALSE,FALSE
,Point Location Assessment Units - 2018,"The Clean Water Act (CWA) requires Michigan to prepare a biennial report on the quality of its water resources as the principal means of conveying water quality protection/monitoring information to the United States Environmental Protection Agency (USEPA) and the United States Congress. The Integrated Report satisfies the listing requirements of Section 303(d) and the reporting requirements of Section 305(b) and 314 of the CWA. The Section 303(d) list includes Michigan water bodies that are not attaining one or more designated use and require the establishment of Total Maximum Daily Loads (TMDLs) to meet and maintain Water Quality Standards. It should be noted that these comprehensive datasets include Assessment Units throughout the state of Michigan, and are not limited to those on the Section 303d list. Further information, including a comprehensive 303(d) list, can be found onEGLE's Integrated Report webpage.",English,"Michigan Dept. of Environment, Great Lakes, and Energy",State of Michigan,Geospatial data,,EGLE|CWA|Michigan|SurfaceWater|WaterQuality|Attainment|303d|305b|314|TMDL|Assessment|AUID|IntegratedReport|IR|Integrated|Report|SWAS|DesignatedUse|LakesandStreams,2020-10-29T12:47:56.000Z,,,,Michigan,"['-89.9417', '41.7646', '-82.3908', '47.4569']",Dataset|Service,Vector,Shapefile,https://gis-michigan.opendata.arcgis.com/datasets/ce223f92120146f191e7b50a8713d092_0,https://gis-michigan.opendata.arcgis.com/datasets/ce223f92120146f191e7b50a8713d092_0.zip,https://gisago.mcgi.state.mi.us/arcgis/rest/services/EGLE/AUID2018/MapServer/0,,,ce223f92120146f191e7b50a8713d092_0,Michigan State,06a-01,06a-01,Active,ArcGIS Hub,,Public,,FALSE,FALSE
,Ride On Routes,Realtime RideOn bus data,English,"Montgomery County, MD","Montgomery County, Maryland",Geospatial data,,RideOn|RideOnRoutes|MCGGisOpenDataTransportation,2020-10-28T20:08:58.000Z,,,,"Montgomery County, Maryland|Maryland","['-77.4178', '38.9350', '-76.9283', '39.2886']",Dataset|Service,Vector,Shapefile,https://data2018-mcgov-gis.opendata.arcgis.com/datasets/8b517e9197a8455b823de97333f3eb52_0,https://data2018-mcgov-gis.opendata.arcgis.com/datasets/8b517e9197a8455b823de97333f3eb52_0.zip,,https://gis4.montgomerycountymd.gov/arcgis/rest/services/DOT/rideon_routes/FeatureServer/0,,8b517e9197a8455b823de97333f3eb52_0,Maryland,04b-24031,04b-24031,Active,ArcGIS Hub,,Public,,FALSE,FALSE
,Flash Bus Rapid Transit,,English,"Montgomery County, MD","Montgomery County, Maryland",Geospatial data,,FlashBusRapidTransit|MCGGisOpenDataTransportation,2020-10-28T19:54:34.000Z,,,,"Montgomery County, Maryland|Maryland","['-77.0306', '38.9932', '-76.9285', '39.1151']",Dataset|Service,Vector,Shapefile,https://data2018-mcgov-gis.opendata.arcgis.com/datasets/2a82ff0facb2494993346b0370aa9698_0,https://data2018-mcgov-gis.opendata.arcgis.com/datasets/2a82ff0facb2494993346b0370aa9698_0.zip,,https://gis4.montgomerycountymd.gov/arcgis/rest/services/DOT/flash_brt/FeatureServer/0,,2a82ff0facb2494993346b0370aa9698_0,Maryland,04b-24031,04b-24031,Active,ArcGIS Hub,,Public,,FALSE,FALSE
,Allegheny County Parcel Boundaries via PASDA,"This dataset contains parcel boundaries attributed with county block and lot number. Use theProperty Information Extractorfor more control downloading a filtered parcel dataset.If viewing this description on the Western Pennsylvania Regional Data Center's open data portal (http://www.wprdc.org), this dataset is harvested on a weekly basis from Allegheny County's GIS data portal (http://openac.alcogis.opendata.arcgis.com/). The full metadata record for this dataset can also be found on Allegheny County's GIS portal. You can access the metadata record and other resources on the GIS portal by clicking on the ""Explore"" button (and choosing the ""Go to resource"" option) to the right of the ""ArcGIS Open Dataset"" text below.Category: Civic Vitality and GovernanceOrganization: Allegheny CountyDepartment: Department of Real EstateTemporal Coverage: currentData Notes:Coordinate System: Pennsylvania State Plane South Zone 3702; U.S. Survey FootDevelopment Notes: noneOther: noneRelated Document(s): Data Dictionary (none)Frequency - Data Change: Multiple times per hourFrequency - Publishing: MonthlyData Steward Name: Eli ThomasData Steward Email:gishelp@alleghenycounty.us",English,"County of Allegheny, PA","Allegheny County, Pennsylvania",Geospatial data,,PASDA|planning|property|boundaries|parcel,2020-11-17T16:32:17.000Z,,,,"Allegheny County, Pennsylvania|Pennsylvania","['-80.3739', '40.1858', '-79.6778', '40.6838']",Dataset|Service,Vector,Shapefile,https://openac-alcogis.opendata.arcgis.com/datasets/94176f3ba06b4b0cb02cd1e1d42cade7_25,https://openac-alcogis.opendata.arcgis.com/datasets/94176f3ba06b4b0cb02cd1e1d42cade7_25.zip,https://maps.pasda.psu.edu/arcgis/rest/services/pasda/AlleghenyCounty/MapServer/25,,,94176f3ba06b4b0cb02cd1e1d42cade7_25,Penn State,08b-42003,08b-42003,Active,ArcGIS Hub,,Public,,FALSE,FALSE
,Allegheny County Addressing Street Centerlines via PASDA,"This dataset shows the road centerlinesin Allegheny County.If viewing this description on the Western Pennsylvania Regional Data Center's open data portal (http://www.wprdc.org), this dataset is harvested on a weekly basis from Allegheny County's GIS data portal (http://openac.alcogis.opendata.arcgis.com/). The full metadata record for this dataset can also be found on Allegheny County's GIS portal. You can access the metadata record and other resources on the GIS portal by clicking on the ""Explore"" button (and choosing the ""Go to resource"" option) to the right of the ""ArcGIS Open Dataset"" text below.Category: Civic Vitality and GovernanceOrganization: Allegheny CountyDepartment: Department of Computer ServicesTemporal Coverage: CurrentData Notes:Coordinate System: Pennsylvania State Plane South Zone 3702; U.S. Survey FootDevelopment Notes: noneOther: noneRelated Document(s): Addressing Data ModelFrequency - Data Change: As neededFrequency - Publishing: MonthlyData Steward Name: Deb BeiberData Steward Email:deborah.beiber@alleghenycounty.us",English,"County of Allegheny, PA","Allegheny County, Pennsylvania",Geospatial data,,PASDA|street|centerlines|alleghenycounty|address|addressing|transportation|geography,2020-11-17T17:32:52.000Z,,,,"Allegheny County, Pennsylvania|Pennsylvania","['-80.3658', '40.1839', '-79.6736', '40.6860']",Dataset|Service,Vector,Shapefile,https://openac-alcogis.opendata.arcgis.com/datasets/e95f6eca47f84f2ab150578d07d559ac_7,https://openac-alcogis.opendata.arcgis.com/datasets/e95f6eca47f84f2ab150578d07d559ac_7.zip,https://maps.pasda.psu.edu/arcgis/rest/services/pasda/AlleghenyCounty/MapServer/7,,,e95f6eca47f84f2ab150578d07d559ac_7,Penn State,08b-42003,08b-42003,Active,ArcGIS Hub,,Public,,FALSE,FALSE
,Public WiFi Locations,"This dataset shows the location of institutional and crowdsourced WiFi locations in Western Pennsylvania.If viewing this description on the Western Pennsylvania Regional Data Center's open data portal (http://www.wprdc.org), this dataset is harvested on a weekly basis from Allegheny County's GIS data portal (http://openac.alcogis.opendata.arcgis.com/). The full metadata record for this dataset can also be found on Allegheny County's GIS portal. You can access the metadata record and other resources on the GIS portal by clicking on the ""Explore"" button (and choosing the ""Go to resource"" option) to the right of the ""ArcGIS Open Dataset"" text below.Category: OtherOrganization: Allegheny CountyDepartment: Department of Human ServicesTemporal Coverage: presentData Notes:Coordinate System: Pennsylvania State Plane South Zone 3702; U.S. Survey FootDevelopment Notes: noneOther: noneRelated Document(s): Data Dictionary: noneFrequency - Data Change: As neededFrequency - Publishing: As neededData Steward Name: Remake Learning & DHSData Steward Email:Covid19-Supplies@alleghenycounty.us",English,"County of Allegheny, PA","Allegheny County, Pennsylvania",Geospatial data,,internet|WiFi|computers|connectivity,2020-07-29T15:27:40.000Z,,,,"Allegheny County, Pennsylvania|Pennsylvania","['-180.0000', '-90.0000', '180.0000', '90.0000']",Dataset|Service,Vector,Shapefile,https://openac-alcogis.opendata.arcgis.com/datasets/54eab6d35af142abab3fb39098662a85_0,https://openac-alcogis.opendata.arcgis.com/datasets/54eab6d35af142abab3fb39098662a85_0.zip,,https://services1.arcgis.com/vdNDkVykv9vEWFX4/arcgis/rest/services/WiFi_Locations_Public/FeatureServer/0,,54eab6d35af142abab3fb39098662a85_0,Penn State,08b-42003,08b-42003,Active,ArcGIS Hub,,Public,,FALSE,FALSE
,Allegheny County Park Features,"A combination of all park features, events, recreations, facilities, all in one layer, including Activenet information.If viewing this description on the Western Pennsylvania Regional Data Center's open data portal (http://www.wprdc.org), this dataset is harvested on a weekly basis from Allegheny County's GIS data portal (http://openac.alcogis.opendata.arcgis.com/). The full metadata record for this dataset can also be found on Allegheny County's GIS portal. You can access the metadata record and other resources on the GIS portal by clicking on the ""Explore"" button (and choosing the ""Go to resource"" option) to the right of the ""ArcGIS Open Dataset"" text below.Category: RecreationOrganization: Allegheny CountyDepartment: Parks DepartmentTemporal Coverage: presentData Notes:Coordinate System: Pennsylvania State Plane South Zone 3702; U.S. Survey FootDevelopment Notes: noneOther: noneRelated Document(s): Data Dictionary: noneFrequency - Data Change: As neededFrequency - Publishing: As neededData Steward Name: Eli ThomasData Steward Email:gishelp@alleghenycounty.us",English,"County of Allegheny, PA","Allegheny County, Pennsylvania",Geospatial data,,Parks|Activenet|events|recreation|facilities|picnic|sports|tennis|court|shelters|field|ballfield|soccer|pools|swimmingpools|camping|stage|barn|skatingrink|rink|horse|volleyball|bocce,2020-10-23T15:38:35.000Z,,,,"Allegheny County, Pennsylvania|Pennsylvania","['-80.1629', '40.2351', '-79.6940', '40.6622']",Dataset|Service,Vector,Shapefile,https://openac-alcogis.opendata.arcgis.com/datasets/13722cbefb0947ea96efe1d07f9a72f8_0,https://openac-alcogis.opendata.arcgis.com/datasets/13722cbefb0947ea96efe1d07f9a72f8_0.zip,,https://services1.arcgis.com/vdNDkVykv9vEWFX4/arcgis/rest/services/Allegheny_County_Park_Features/FeatureServer/0,,13722cbefb0947ea96efe1d07f9a72f8_0,Penn State,08b-42003,08b-42003,Active,ArcGIS Hub,,Public,,FALSE,FALSE
,PrecinctResults,Feature layer generated from running the Join Features solution,English,Centre County Government,"Centre County, Pennsylvania",Geospatial data,,AnalysisResult|JoinFeatures,2020-10-30T21:46:38.000Z,,,,"Centre County, Pennsylvania|Pennsylvania","['-78.3818', '40.6900', '-77.1415', '41.2535']",Dataset|Service,Vector,Shapefile,https://gisdata-centrecountygov.opendata.arcgis.com/datasets/505256c020f34289b7f73f76334d2d7a_0,https://gisdata-centrecountygov.opendata.arcgis.com/datasets/505256c020f34289b7f73f76334d2d7a_0.zip,,https://services3.arcgis.com/HDjl48g0Y109Q9wX/arcgis/rest/services/PrecinctResults/FeatureServer/0,,505256c020f34289b7f73f76334d2d7a_0,Penn State,08b-42027,08b-42027,Active,ArcGIS Hub,,Public,,FALSE,FALSE
,Election Precincts,Election Precincts for DuPage County IL.,English,DuPage County Illinois,"DuPage County, Illinois",Geospatial data,,Elections|ElectionPrecincts|Precincts|precincts|political|precinct|Election,2017-05-25T14:21:47.000Z,,,,"DuPage County, Illinois|Illinois","['-88.2633', '41.6856', '-87.9125', '41.9956']",Dataset|Service,Vector,Shapefile,https://gisdata-dupage.opendata.arcgis.com/datasets/4eddbc9f5fd042edb82d6a23d191d8d2_0,https://gisdata-dupage.opendata.arcgis.com/datasets/4eddbc9f5fd042edb82d6a23d191d8d2_0.zip,https://gis.dupageco.org/arcgis/rest/services/DuPage_County_IL/Election_Precincts/MapServer/0,,,4eddbc9f5fd042edb82d6a23d191d8d2_0,Chicago,12b-17043,12b-17043,Active,ArcGIS Hub,,Public,,FALSE,FALSE
,Points Of Interest,"All Category/Type combinations for MORPC Points of Interest data, for 15-counties in Central Ohio, showing places of commercial activity, transportation, public places, hospitals, industrial (landfills, waste transfer stations, quarries, wastewater and water treatment), group quarters, government locations, and public places. Geography: 15 county Central Ohio region: Delaware, Fairfield, Fayette, Franklin, Hocking, Knox, Licking, Logan, Madison, Marion, Morrow, Perry, Pickaway, Ross, and Union Counties.Source: Sources vary by point category and type. Query ""source"" attribute on a specific point for more.",English,agol4cogis,State of Ohio,Geospatial data,,pointsofinterest|commercialactivity|transportation|publicplace|hospital|industrial|groupquarters|government|publicplaces|GIS|data|GeographicInformationSystems|CentralOhio|MORPC|County|MPO|Non-Profit|RegionalCouncil|RegionalAssociation,2017-12-20T16:09:29.000Z,,,,Ohio,"['-83.9789', '39.1911', '-82.0687', '40.7868']",Dataset|Service,Vector,Shapefile,https://ogrip-geohio.opendata.arcgis.com/datasets/83133feb396344a382802e49671228dc_0,https://ogrip-geohio.opendata.arcgis.com/datasets/83133feb396344a382802e49671228dc_0.zip,https://arcgisserver2.morpc.org/webadaptor/rest/services/PointsOfInterest/POI/MapServer/0,,,83133feb396344a382802e49671228dc_0,Ohio State,11a-01,11a-01,Active,ArcGIS Hub,,Public,,FALSE,FALSE
,Water,"The major water bodies within the Minneapoliscity limits. Includes polygons for the Mississippi River, major lakes, and streams.If there are any issues with the data in this map, service, or shp file please contact the MinneapolisGIS office.",English,MapIT Minneapolis,"City of Minneapolis, Minnesota",Geospatial data,,water|Minneapolis|lakes|rivers|Environment,2020-11-03T15:32:52.000Z,,,,"Minneapolis, Minnesota|Minnesota","['-93.3299', '44.8908', '-93.1904', '45.0521']",Dataset|Service,Vector,Shapefile,https://opendata.minneapolismn.gov/datasets/a5e99776bbab494da81deb9c79bab31d_0,https://opendata.minneapolismn.gov/datasets/a5e99776bbab494da81deb9c79bab31d_0.zip,,https://services.arcgis.com/afSMGVsC7QlRK1kZ/arcgis/rest/services/Water/FeatureServer/0,,a5e99776bbab494da81deb9c79bab31d_0,Minnesota,05c-01,05c-01,Active,ArcGIS Hub,,Public,,FALSE,FALSE
,Leaf Dropoff Sites,,English,City of Philadelphia,"City of Philadelphia, Pennsylvania",Geospatial data,,Authoritative|LeafDropoffSites|Streets,2020-10-26T15:10:07.000Z,,,,"Philadelphia, Pennsylvania|Pennsylvania","['-75.2451', '39.9124', '-75.0760', '40.0782']",Dataset|Service,Vector,Shapefile,https://data-phl.opendata.arcgis.com/datasets/ecb6a9417aba44b5b36059691f8a153a_0,https://data-phl.opendata.arcgis.com/datasets/ecb6a9417aba44b5b36059691f8a153a_0.zip,,https://services.arcgis.com/fLeGjb7u4uXqeF9q/arcgis/rest/services/Leaf_Dropoff_Sites/FeatureServer/0,,ecb6a9417aba44b5b36059691f8a153a_0,Penn State,08c-02,08c-02,Active,ArcGIS Hub,,Public,,FALSE,FALSE
