Title,Alternative Title,Description,Language,Creator,Publisher,Genre,Subject,Keyword,Date Issued,Temporal Coverage,Date Range,Solr Year,Spatial Coverage,Bounding Box,Type,Geometry Type,Format,Information,Download,MapServer,FeatureServer,ImageServer,Identifier,Provenance,Code,Is Part Of,Status,Accrual Method,Date Accessioned,Rights,Access Rights,Suppressed,Child
,STIP Lines (Approved),"Data in this dataset is refreshed nightly regardless of the last update date.The State Transportation Improvement Program (STIP) is a list of projects that the state proposes to fund with federal aid.MDOT STIP WebsiteDescriptionData from ""All Projects Search"" report from the Planning DB schemaCollection DateOn a daily basis as updates are made to the Planning DB schemaUpdate CycleOn a daily basis as updates are made to the Planning DB schemaData QualityInput via JobNet application and is subject to MDOT/Fed business rules and validationsCoverageEntire stateSymbologyLinear and point datasetsContactBhavana ChandrayanField NameField AliasField DescriptionData TypeCoded Values?JobNet_IDJob # Job_Type_CDIndicates the Job Type. U = Multi-Modal, T=Trunkline and L -LocalYesSTIP_FISCL_YRFiscal Year CNYT_DESCCounty AGN_TYPEIndicates the type of Agency: county, municipality, etc. AGN_NameResponsible Agency RPT_RTE_NAMEProject Name PR_RTE_NameThe Route Name on the major PR. RPT_LOC_DESCLimits CNSTR_LGTHLength RPT_WRK_DESCProject Description FUND_SRC_DESCFund Source. Note: Unlike in report, per the requirements, multiple fund sources are shown comma separated. Since this export ONLY reports rolled up budgetsYesTOT_PRJ_COSTTotal Job Cost BNDRY_DESCMPO/Rural Field NameCodeCode Value DescriptionJob_Type_CDUMulti-ModalTTrunklineLLocal FUND_SRC_DESCNHFPNATIONAL HIGHWAY FREIGHT PROGRAMNHFINATIONAL HIGHWAY FREIGHT INTERSTATENSFHNATIONAL SIGNIFICANT FREIGHT AND HIGHWAY PROJECTSFBPFERRY BOAT PROGRAMEMRPEARMARK REPURPOSEDSPRSTATEWIDE PLANNING & RESEARCHRPRESEARCH PROJECTEDFECON DEVELOPMENT CATEGORY FFLHFEDERAL LANDS HIGHWAYS PUBLIC LANDSAMAERONAUTICS 50% STATE & 50% LOCALFBDFERRY BOAT & TERMINAL DISCRETIONARYSTULSURFACE TRANS URBAN AREAS < 200K POP LOCALSTUTSURFACE TRANS URBAN AREAS < 200K POP TRUNKLNSUGSURFACE TRANS SAFETY 100% FED FOR STU-ITEMSSSTDBE Supportive ServicesSTSURFACE TRANSPORTATION ANY AREASTESURFACE TRANSPORTATION ENHANCEMENTSTGSURFACE TRANS SAFETY 100% FED FOR ST-ITEMSSTLSURFACE TRANSPORTATION RURALSTUSURFACE TRANS URBAN AREAS > 200K POPNHNATIONAL HIGHWAY SYSTEMHSGHIGH SPEED RAIL ROAD CROSSING 100%IMINTERSTATE MAINTENANCE NO ADDED LANESLTALOCAL TECHNICAL ASSISTANCEMMICHIGAN FUNDS MICHIGAN BETTERMENTMCSMICHIGAN CRITICAL STRUCTURESMDAMICHIGAN DRAINAGE ASSESSMENTMERMICHIGAN EMERGENCYMIRMICHIGAN INSTITUTIONAL ROADSNHGNATIONAL HIGHWAY SAFETY100% FEDERALEDCECON DEVELOPMENT CATEGORY CEDCFECON DEVELOPMENT CATEGORY C WITH FEDERALEDDECON DEVELOPMENT CATEGORY DEDAFECON DEVELOPMENT CATEGORY A WITH FEDERALFFHFEDERAL FOREST HIGHWAYBHTBRIDGE REHAB SURFACE TRANSPORTATIONEDFFECON DEVELOPMENT CATEGORY F WITH FEDERALEREMERGENCY RELIEFCMCONGESTION MITIGATION AIR QUALITYCMGCONGESTION MITIGATION 100% FEDERALEBAECON DEVELOP CATEGORY A WITH BONDEDAECON DEVELOPMENT CATEGORY AALAERONAUTICS STANDARD AIP PRE 2004 and POST 2011BRTBRIDGE REPLACEMENT SURFACE TRANSPORTATIONDPDEMONSTRATION FEDERAL AID SYSTEMITSINTELLIGENT TRANSPORTATION SYSTEMSPRGSTATEWIDE PLANNING & RESEARCH 100% FEDERALCTFCOMPREHENSIVE TRANSPORTATION FUNDNRTNATIONAL RECREATIONAL TRAILSSBDSCENIC BYWAYS DISCRETIONARYHPPHIGH PRIORITY PROJECTS DEMONSTRATIONMRRMICHIGAN RAILROADSTTSURFACE TRANS WAS RURAL SECONDARY TRUNKLINEEDDFECON DEVELOPMENT CATEGORY D WITH FEDERALIMDINTERSTATE MAINTENANCE DISCRETIONARYIMGINTERSTATE MAINTENANCE SAFETY 100% FEDERALPLMETRO PLANNINGDPIDEMONSTRATION FEDERAL AID SYS INTERSTATEMBWBMICHIGAN BLUE WATER BRIDGEMXNON STATE FUNDED 100% LOCALAAAERONAUTICS METRO STANDARD RATEAGAERONAUTICS NOISE PROGRAMABAERONAUTICS FEDERAL BLOCK GRANTSAKAERONAUTICS STANDARD AIP AIP 2004 & AFTERHPSLHIGH PRIORITY PROJECTS SAFETEA-LUEBSLEQUITY BONUS SAFETEA-LUCBIPCORRIDOR & BORDER INFRASTRUCTE SAFETEA-LUSRSESAFE ROUTES TO SCHOOL EITHER SAFETEA-LUSRSISAFE ROUTES TO SCHOOL INFRASTRUCT SAFETEA-LUSRSNSAFE ROUTES TO SCHOOL NON INFRAST SAFETEA-LUTIPTRANS IMPROVEMENT PROJECTS SAFETEA-LUDPSADEMONSTRATION SECTION 112 DIVISION AHSIPHIGHWAY SAFETY IMPROVEMENTHRRRHIGH RISK RURAL ROADS HSIP SAFETEA-LUBOWDOJT Training Supportive Services5304CTF STATEWIDE TRANSPORTATION PLANNING5303CTF METRO TRANSPORTATION PLANNING5307CTF URBANIZED FORMULA5309CTF CAPITAL PROGRAM5310CTF ELDERLY AND DISABLED5311CTF NON URBAN FORMULA5316CTF JOB ACCESS REVERSE COMMUTE5317CTF NEW FREEDOMPNRSPROJECTS OF NATIONAL AND REGIONAL SIGNIFICANCETCSPTRANS COMMUNITY AND SYSTEM PRESERVATIONARTGARRA TIGER GRANTDSTPDEMONSTRATION SURFACE TRANSPORTATION PRIORITIESHIPHighway Infrastructure Program - FlexTPFDTRUCK PARKING FACILITIES DISCRETIONARY5308CTF CLEAN FUELS PROGRAM5320CTF ALTERNATIVE TRNSP. PARKS AND PUBLIC LAND5339CTF ALTERNATIVE ANALYSISCPMCMAQ PROJECTS TO REDUCE PM 2.5 EMISSIONSBOBRIDGE NOT CLASSIFIED OFF SYSTEMSTRPSURFACE TRANS SAFETY HWY XXING PROTECTION DEVICESSTRHSURFACE TRANS SAFETY HWY XXING HAZARD ELIMINATIONSRHGSURFACE SAFETY HWY XXING HAZARD ELIMINATION 100%SRPGSURFACE SAFETY HWY XXING PROTECTION DEVISES 100%TATRANSPORTATION ALTERNATIVES PROGRAM FLEXTAUTRANSPORTATION ALTERNATIVES URBAN AREAS > 200K POPTAULTRANSPORTATION ALTERNATIVES URBAN AREAS < 200K POPTALTRANSPORTATION ALTERNATIVES RURALIPDINNOVATIVE PROJECT DELIVERYRRRFMICHIGAN ROADS AND RISKS RESERVE FUNDD129DEMONSTRATION SURF TRANS PRIORITIES SECTION 129PRIPPRIORITY ROADS INVESTMENT PROGRAMAIDACCELERATED INNOVATION DEPLOYMENT DEMONSTRATIONTIGRTIGER DISCRETIONARY GRANT (USDOT)FLAPFederal Lands Access ProgramGF15GENERAL FUND MONEY - GF15GF16GENERAL FUND MONEY - GF16BOIBridge Off System Interstate - No Added CapacityGF18GENERAL FUND MONEY - GF18GF19GENERAL FUND MONEY - GF1911ECTF Non Urban Formula STIP ExemptCTFRCTF- Rail5329CTF State Safety Oversight5337CTF State Of Good RepairMXE100% Local Funds STIP exemptHIPUHIP Urban AreasHIPSHIP Small Urban AreasHIPLHIP Rural AreasINFRINFRA GRANTSBUILBUILD Grants ",English,Michigan Department of Transportation,State of Michigan,Geospatial data,,MDOT|STIP|Planning,2019-04-09T12:05:40.000Z,,,,Michigan,"['-90.4144', '41.6981', '-82.4203', '47.4218']",Dataset|Service,Vector,Shapefile,https://gis-michigan.opendata.arcgis.com/datasets/2531be0a528c4a40833c529871b29d08_4,https://gis-michigan.opendata.arcgis.com/datasets/2531be0a528c4a40833c529871b29d08_4.zip,,https://utility.arcgis.com/usrsvcs/servers/2531be0a528c4a40833c529871b29d08/rest/services/MDOT/MdotStipOpenData/FeatureServer/4,,2531be0a528c4a40833c529871b29d08_4,Michigan State,06a-01,06a-01,Active,ArcGIS Hub,,Public,,FALSE,FALSE
,Building Footprints,"SEMCOG maintains three separate data layers that represent information on built structures in Southeast Michigan: building footprints, building points, and condominium points. The Building Footprints were the first dataset collected. These were originally developed by using heads-up digitizing to trace the outlines of buildings in 2010 aerial photography. This process was repeated later using 2015 and 2019 imagery. Due to differences in spatial accuracy between the 2010 and later imagery sources, footprint polygons delineated using 2010 aerial photography may appear slightly shifted compared with imagery that is more recent. This dataset is current as of April 2019, and contains only three attributes: the unique building identifier, median height and the source of the footprint polygon. The Building Points dataset is a point layer representing a single point, at the center of the structure, for each building in Southeast Michigan as of April 2020. For buildings with an associated footprint polygon, the building point represents the centroid of the polygon. For newer structures, a point is placed at the approximate center of the structure as shown in recent imagery, as no footprint polygon yet exists. Since it is the building points that represent our most current universe of buildings in the region, this is the dataset on which we store the associated attributes of a building, mainly location and physical characteristics obtained from local assessing data and other sources. The Condominium Points dataset is also a point layer, with each point representing an attached condominium unit located within a building. Unlike site condominiums, attached condominiums are by definition only a portion of a single building, but as each unit can be individually owned they need to be tracked independently. To ensure an accurate match between condominium points and the building in which they are located, the condominium points are placed on the building centroid, and do not represent the actual physical location of the unit.Building AttributesAs stated above, SEMCOG maintains building attributes on the building points data layer. The condominium points and building footprints data layers have only a small subset of these attributes. Table B.1 list the current attributes of the buildings dataset:Table B.1Buildings Dataset AttributesFIELDTYPEDESCRIPTIONBUILDING_IDLong IntegerUnique identification number assigned to each building.PARCEL_IDLong IntegerIdentification number of the parcel on which the building is located.BUILD_TYPEIntegerBuilding type. Please see page three for a detailed description of the types.CITY_IDIntegerIdentification number of the municipality, or for Detroit, master plan neighborhood, in which the building is located.APNVarchar(24)Tax assessing parcel number of the parcel on which the building is located.RES_SQFT 3Long IntegerSquare footage devoted to residential use. NONRES_SQFT 3Long IntegerSquare footage devoted to nonresidential activity.YEAR_BUILTIntegerYear structure was built. A value of 0 indicates the year built is unknown.DEMOLISHEDDateDate structure was demolished. Buildings existing in 2010 but since demolished are maintained in the master file.HOUSING_UNITSIntegerNumber of residential housing units in the building.STORIESFloat(5.2)Number of stories. For single-family residential this number is expressed in quarter fractions from 1 to 3 stories: 1.00, 1.25, 1.50, etc.LOADD1Long IntegerStreet number, or lowest number for an address range.HIADD1Long IntegerHighest street number for an address range. A value of 0 indicates a single address for the building.STREET1Varchar(32)Street name on which the building is located.LOADD2Long IntegerStreet number, or lowest number for an address range, of second street address.HIADD2Long IntegerHighest street number for an address range, of second street address. A value of 0 indicates a single second address for the building.STREET2Varchar(32)Street name on which the building is located, of second street address.ZIPCODEVarchar(5)USPS postal code for the building address.AKAVarchar(40)Alternate name or business name of the structure, if known.GQCAPIntegerMaximum number of group quarters residents, if any.CONDO_ID 1Long IntegerUnique identification record assigned to each condominium record.MEDIAN_HGT 2IntegerMedian height of the building from LiDAR surveys, NULL if unknown.SOURCE 2Varchar(10)Source of footprint polygon: NEARMAP, OAKLAND, SANBORN or SEMCOG.1. Attribute only in the Condominium Points layer. 2. Attribute only in the Building Footprints layer.3. Square footage evenly divisible by 100 is an estimate, based on size and/or type of building, if the true value is unknown. Building TypesSEMCOG's building types are based on the 2017 North American Industrial Classification System (NAICS). This system classifies establishments based on economic activity, is widely accepted by the planning community, and used by SEMCOG in developing its long-range socioeconomic forecasts. Each of the 22 nonresidential building types represent one or more entire 3-digit NAICS sector groupings, except for five special types of building that do not fit within this system. These specific types of activity (movie theaters, libraries, dormitories, funeral services, and parking garages) have land use and trip generation characteristics that are different from the other types of activity in their respective NAICS sector and are therefore classified individually. More information on NAICS, including descriptions of the economic activity sectors, can be found at the Census Bureau's NAICS web site. There are also four residential building types, which assist us in tracking housing development over time. Residential types are based on a combination of units in structure, and if the units can be individually owned. Single-family homes and site condominiums typically contain only one unit, but there are cases of traditional duplexes where one owner owns both units, that are also classified as single-family. Attached condo buildings contain two or more housing units in a single building, each of which shares one or more walls with an adjoining unit and can be independently owned. Multi-family housing or apartment buildings contain three or more units, all of which are owned by a single entity and intended as rental units. Figure B.1Distribution of Buildings by Type As seen in Figure B.1, over 90 percent of all buildings are single-family homes, and only 6.2 percent of buildings are of any nonresidential building type.Mobile homes are a special type of building, as it represents not a single unit but one point summarizing the total number of mobile homes located in each manufactured housing park. This is done because the units themselves are mobile, easily transportable, and the number of such units in a manufactured housing park varies on a monthly basis. We update these counts on an annual basis.There are structures that SEMCOG does not classify as buildings. To be considered a building, a structure must contain either a housing unit or a minimum of 250 square feet of nonresidential workspace. Therefore, garages, boathouses, and other accessory structures are not classified as buildings. A description of SEMCOG building types, including the relevant NAICS codes for the type, can be found in Table B.2:Table B.2Building Types by NAICS SectorBUILD TYPEDESCRIPTIONNAICS SECTORSRGB11Educational611190-232-25513Religious and Civic8130-132-16814Governmental921-9280-76-11521Retail Building441-454, 811-812255-190-19023Office Building511-551, 561255-0-031Manufacturing311-339194-158-21532Wholesale Trade423-425170-102-20533Warehouse and Storage493112-68-13741Transportation and Utility221, 481-488, 562204-204-20442Delivery Services491-492156-156-15651Health and Social Services621, 624214-157-18852Hospital622245-122-18253Residential Care Facility623137-68-10161Leisure Activity711-713137-205-10263Hotel and Motel721209-255-11565Eating and Drinking72285-255-071Agricultural111-213255-255-081Single-Family HousingResidential255-211-12782Attached Condo BuildingResidential230-152-083Multi-Family ApartmentResidential137-112-6884Mobile HomeResidential137-68-6891Movie Theater51213168-0-092Library519120-197-25593Dormitory Quarters7213192-137-6894Funeral Services81220255-127-12795Parking Garage8129378-78-78The RGB color values match SEMCOG's typical map symbology for building types.Relationship between Buildings LayersCounty land parcel layers are used to assign the unique APN (Assessor Parcel Number), as well as parcel identifier, to each structure located on a parcel by means of spatial intersection between the parcels and buildings layers. However, there are counties which do not represent parcel splits in their parcel layer when large vacant parcels are developed into single-family subdivisions. In these cases, the polygon geometry of the original parent parcel is cloned once for each new child parcel. A geospatial intersection of buildings to parcels in this situation would lead to each building in the subdivision being assigned to whichever parcel polygon happened to be sitting on top of the stack of cloned parcels. In these cases we use other sources, such as building permits and developer site plans, to identify the APN of each new building, and then assign the parcel identifier by finding the land parcel with that APN. Figure B.2Primary Key Relationship of Buildings LayersLand ParcelsBuilding FootprintsBuilding PointsCondominium Pointsparcel_id (unique) ----->parcel_id --------------->parcel_id --------------->parcel_idbuilding_id (unique) --->building_id (unique) --->building_idAPN (unique) ---------->APN -------------------->APN -------------------->APN (unique)condo_id (unique)The APN and parcel identifier are passed to each building on a parcel, with each building assigned a unique building identifier. Since building points are the centroid of building footprints, they share the same building identifier as they reference the same structure. Condominium records are assigned a unique condo identifier, and also the building identifier of the structure they are located within. By this process, each layer has a unique identifier, and can be related to the larger parent geography as needed.Last Update: 08/18/2020",English,Southeast Michigan Council of Governments,State of Michigan,Geospatial data,,BuildingFootprints|Footprints|Buildings|BuildingOutlines|land,2020-07-08T16:29:37.000Z,,,,Michigan,"['-83.6981', '42.0402', '-82.8598', '42.8932']",Dataset|Service,Vector,Shapefile,https://gis-michigan.opendata.arcgis.com/datasets/72152aba68924bc29c9af749172c7918_0,https://gis-michigan.opendata.arcgis.com/datasets/72152aba68924bc29c9af749172c7918_0.zip,,https://services1.arcgis.com/xUx8EjNc6egUPYWh/arcgis/rest/services/Building_Footprints/FeatureServer/0,,72152aba68924bc29c9af749172c7918_0,Michigan State,06a-01,06a-01,Active,ArcGIS Hub,,Public,,FALSE,FALSE
