Title,Alternative Title,Description,Language,Creator,Publisher,Genre,Subject,Keyword,Date Issued,Temporal Coverage,Date Range,Solr Year,Spatial Coverage,Bounding Box,Type,Geometry Type,Format,Information,Download,MapServer,FeatureServer,ImageServer,Identifier,Provenance,Code,Is Part Of,Status,Accrual Method,Date Accessioned,Rights,Access Rights,Suppressed,Child
,Roadway Block,"For a city, street blocks are a very common way in which to organize and relate work (e.g. 'I need to fix a pothole on the 1600 Block of Pennsylvania Ave'). Although driveways or alleys may intersect streets, this representation requires that the segment remain unbroken. Road types include streets. Previously Called Street Segments. Note that there are no from/to address fields. We will not be maintaining them in our data. There also will be no generating a 'streetname' list.For more information please visitDDOT's wiki page.",English,"City of Washington, DC","Washington, District of Columbia",Geospatial data,,LRS|transportation|roadwayhub|roadway|linearreferencing|DDOT,2020-11-13T15:37:13.000Z,,,,"Washington, District of Columbia|District of Columbia|Maryland|Virginia","['-77.1167', '38.7932', '-76.9094', '38.9953']",Dataset|Service,Vector,Shapefile,https://opendata.dc.gov/datasets/6fcba8618ae744949630da3ea12d90eb_163,https://opendata.dc.gov/datasets/6fcba8618ae744949630da3ea12d90eb_163.zip,https://maps2.dcgis.dc.gov/dcgis/rest/services/DCGIS_DATA/Transportation_WebMercator/MapServer/163,,,6fcba8618ae744949630da3ea12d90eb_163,Maryland,04c-01,04c-01,Active,ArcGIS Hub,,Public,,FALSE,FALSE
,Roadway SubBlock,"Description: SubBlock represent the near-full extent of our centerline network (only driveways are excluded). SubBlock is the finest grained, 'base' segments from which all other segmentation patterns can be constructed (including Blocks). SubBlock is the original source features for our DDOT Street Centerlines data. Road types include streets, Alleys, Ramps, Service Roads, and Trails. Previously called Roadway Segments. For more information please visitDDOT's wiki page.",English,"City of Washington, DC","Washington, District of Columbia",Geospatial data,,LRS|transportation|roadwayhub|roadway|linearreferencing|DDOT,2020-11-13T15:34:26.000Z,,,,"Washington, District of Columbia|District of Columbia|Maryland|Virginia","['-77.1167', '38.7932', '-76.9094', '38.9953']",Dataset|Service,Vector,Shapefile,https://opendata.dc.gov/datasets/df571ab7fea446e396bf2862d0ab6833_162,https://opendata.dc.gov/datasets/df571ab7fea446e396bf2862d0ab6833_162.zip,https://maps2.dcgis.dc.gov/dcgis/rest/services/DCGIS_DATA/Transportation_WebMercator/MapServer/162,,,df571ab7fea446e396bf2862d0ab6833_162,Maryland,04c-01,04c-01,Active,ArcGIS Hub,,Public,,FALSE,FALSE
,Roadway Intersection Approach,"Roads and Highways manages intersections, however they are not singular points; RH creates a series of points - one for each intersecting road at that intersection. For DDOT, it is more useful to have a single intersection point representing the intersection. Through a custom DDOT script,the series of intersection points is reduced into a single representative point.For more information please visit DDOT's wiki page at https://wiki.ddot.dc.gov/display/GIS/DDOT%27s+Transportation+Data+Products",English,"City of Washington, DC","Washington, District of Columbia",Geospatial data,,LRS|transportation|roadwayhub|roadway|linearreferencing|DDOT,2020-11-13T15:32:59.000Z,,,,"Washington, District of Columbia|District of Columbia|Maryland|Virginia","['-77.1144', '38.7932', '-76.9094', '38.9953']",Dataset|Service,Vector,Shapefile,https://opendata.dc.gov/datasets/a779d051865f461eb2a1f50f10940ec4_161,https://opendata.dc.gov/datasets/a779d051865f461eb2a1f50f10940ec4_161.zip,https://maps2.dcgis.dc.gov/dcgis/rest/services/DCGIS_DATA/Transportation_WebMercator/MapServer/161,,,a779d051865f461eb2a1f50f10940ec4_161,Maryland,04c-01,04c-01,Active,ArcGIS Hub,,Public,,FALSE,FALSE
,Roadway Block Intersection,"Roads and Highways manages intersections, however they are not singular points; RH creates a series of points - one for each intersecting road at that intersection. For DDOT, it is more useful to have a single intersection point representing the intersection. Through a custom DDOT script,the series of intersection points is reduced into a single representative point.For more information please visit DDOT's wiki page at https://wiki.ddot.dc.gov/display/GIS/DDOT%27s+Transportation+Data+Products",English,"City of Washington, DC","Washington, District of Columbia",Geospatial data,,transportation|LRS|roadwayhub|roadway|linearreferencing|DDOT,2020-11-13T15:39:22.000Z,,,,"Washington, District of Columbia|District of Columbia|Maryland|Virginia","['-77.1144', '38.8099', '-76.9094', '38.9953']",Dataset|Service,Vector,Shapefile,https://opendata.dc.gov/datasets/14eb2dba76ad4359bb3ed70068e35231_160,https://opendata.dc.gov/datasets/14eb2dba76ad4359bb3ed70068e35231_160.zip,https://maps2.dcgis.dc.gov/dcgis/rest/services/DCGIS_DATA/Transportation_WebMercator/MapServer/160,,,14eb2dba76ad4359bb3ed70068e35231_160,Maryland,04c-01,04c-01,Active,ArcGIS Hub,,Public,,FALSE,FALSE
,Roadway Blockface,"Blockface Segments are unbroken sections of the curb. A blockface can be made up of several subblocks, or just one subblock. There are blockfaces on both sides of the road, each dependent on an unbroken length of curb.",English,"City of Washington, DC","Washington, District of Columbia",Geospatial data,,transportation|LRS|roadwayhub|roadway|linearreferencing|DDOT,2020-11-13T15:42:39.000Z,,,,"Washington, District of Columbia|District of Columbia|Maryland|Virginia","['-77.1168', '38.7931', '-76.9094', '38.9953']",Dataset|Service,Vector,Shapefile,https://opendata.dc.gov/datasets/47945b50c4f245b58850e81d297e90b9_164,https://opendata.dc.gov/datasets/47945b50c4f245b58850e81d297e90b9_164.zip,https://maps2.dcgis.dc.gov/dcgis/rest/services/DCGIS_DATA/Transportation_WebMercator/MapServer/164,,,47945b50c4f245b58850e81d297e90b9_164,Maryland,04c-01,04c-01,Active,ArcGIS Hub,,Public,,FALSE,FALSE
,Polling Places,"Point feature class containing polling places within Peoria County, Illinois. Attributes include: polling place, polling place address, polling place hours, handicap accessible (Yes/No), next election date, voter registration deadline, contact name, contact phone, contact email, polling place wait time (minutes), township, precinct names, precinct building photos.",English,County of Peoria,"Peoria County, Illinois",Geospatial data,,polling|place|places|voting|vote|elections,2020-11-10T15:45:19.000Z,,,,"Peoria County, Illinois|Illinois","['-89.9799', '40.5679', '-89.4877', '40.9399']",Dataset|Service,Vector,Shapefile,https://data-peoriacountygis.opendata.arcgis.com/datasets/57f3e9e900664aa48aaccb4d0b9e6f89_0,https://data-peoriacountygis.opendata.arcgis.com/datasets/57f3e9e900664aa48aaccb4d0b9e6f89_0.zip,,https://services.arcgis.com/iPiPjILCMYxPZWTc/arcgis/rest/services/Polling_Places/FeatureServer/0,,57f3e9e900664aa48aaccb4d0b9e6f89_0,Chicago,12b-17143,12b-17143,Active,ArcGIS Hub,,Public,,FALSE,FALSE
,Adjusted Census Urban Boundary,"By using this data, you agree to the SEMCOG Copyright License Agreement.2010 Adjusted Census Urban Area/Boundary (ACUA/ACUB): 2010 Adjusted Census Urban Area polygons extracted from version 17 of the Michigan Geographic Framework. Areas include Ann Arbor, MI; Chelsea, MI; Detroit, MI (part); Flint, MI (part); Goodrich, MI (part); Holly, MI; Milan, MI; Monroe, MI; Port Huron, MI (part); Richmond, MI; South Lyon--Howell, MI; and Toledo, OH--MI (part). The ACUB is the official urban/rural dividing line for transportation purposes.",English,Southeast Michigan Council of Governments (SEMCOG),"SEMCOG, Southeast Michigan Council of Governments",Geospatial data,,boundary,2018-08-21T15:29:53.000Z,,,,Michigan,"['-84.0417', '41.7242', '-82.4160', '43.1690']",Dataset|Service,Vector,Shapefile,https://maps-semcog.opendata.arcgis.com/datasets/f530b4a8ae59443ba6b6f6733b89c6ed_0,https://maps-semcog.opendata.arcgis.com/datasets/f530b4a8ae59443ba6b6f6733b89c6ed_0.zip,,https://services1.arcgis.com/xUx8EjNc6egUPYWh/arcgis/rest/services/Adjusted_Census_Urban_Boundary/FeatureServer/0,,f530b4a8ae59443ba6b6f6733b89c6ed_0,Michigan State,06f-01,06f-01,Active,ArcGIS Hub,,Public,,FALSE,FALSE
,DLBA For Sale,"Properties for sale by the Detroit Land Bank Authority through the Auction, Own It Now, and Renovation programs.For more information about the DLBA's sales programsclick here.",English,City of Detroit,"City of Detroit, Michigan",Geospatial data,,dlba|detroit,2020-11-06T22:17:18.000Z,,,,"Detroit, Michigan|Michigan","['-83.2790', '42.2616', '-82.9346', '42.4483']",Dataset|Service,Vector,Shapefile,https://data.detroitmi.gov/datasets/d52a66da906b490196ace267bcb5eb55_3,https://data.detroitmi.gov/datasets/d52a66da906b490196ace267bcb5eb55_3.zip,https://opengis.detroitmi.gov/opengis/rest/services/DLBA/DLBA/MapServer/3,,,d52a66da906b490196ace267bcb5eb55_3,Michigan,07c-01,07c-01,Active,ArcGIS Hub,,Public,,FALSE,FALSE
,Own it Now Sales,Properties sold by the Detroit Land Bank Authority through the Own It Now program.For more information about the DLBA's sales programsclick here.,English,City of Detroit,"City of Detroit, Michigan",Geospatial data,,dlba|detroit,2020-11-06T21:24:25.000Z,,,,"Detroit, Michigan|Michigan","['-83.2868', '42.2575', '-82.9157', '42.4486']",Dataset|Service,Vector,Shapefile,https://data.detroitmi.gov/datasets/219a991c8f3e4788b29e6eb9a29c9f76_2,https://data.detroitmi.gov/datasets/219a991c8f3e4788b29e6eb9a29c9f76_2.zip,https://opengis.detroitmi.gov/opengis/rest/services/DLBA/DLBA/MapServer/2,,,219a991c8f3e4788b29e6eb9a29c9f76_2,Michigan,07c-01,07c-01,Active,ArcGIS Hub,,Public,,FALSE,FALSE
,Side Lots Sold,Properties sold by the Detroit Land Bank Authority through the Side Lot program.For more information about the DLBA's sales programsclick here.,English,City of Detroit,"City of Detroit, Michigan",Geospatial data,,dlba|sidelot|detroit,2020-11-06T20:16:53.000Z,,,,"Detroit, Michigan|Michigan","['-83.2874', '42.2564', '-82.9133', '42.4496']",Dataset|Service,Vector,Shapefile,https://data.detroitmi.gov/datasets/ba8bf1a976204255b2d5841030c43a99_0,https://data.detroitmi.gov/datasets/ba8bf1a976204255b2d5841030c43a99_0.zip,https://opengis.detroitmi.gov/opengis/rest/services/DLBA/DLBA/MapServer/0,,,ba8bf1a976204255b2d5841030c43a99_0,Michigan,07c-01,07c-01,Active,ArcGIS Hub,,Public,,FALSE,FALSE
,DLBA Partner Sales,Properties sold by the Detroit Land Bank Authority through their Community Partner and Projects sales programs.For more information about the DLBA's Community Partnership programclick here. For more information about the DLBA's Projects programclick here.,English,City of Detroit,"City of Detroit, Michigan",Geospatial data,,dlba|sales|property|parcels|detroit,2020-11-06T21:08:14.000Z,,,,"Detroit, Michigan|Michigan","['-83.2859', '42.2592', '-82.9177', '42.4489']",Dataset|Service,Vector,Shapefile,https://data.detroitmi.gov/datasets/09c63e3a9bc74f73b72825841ccd210e_1,https://data.detroitmi.gov/datasets/09c63e3a9bc74f73b72825841ccd210e_1.zip,https://opengis.detroitmi.gov/opengis/rest/services/DLBA/DLBA/MapServer/1,,,09c63e3a9bc74f73b72825841ccd210e_1,Michigan,07c-01,07c-01,Active,ArcGIS Hub,,Public,,FALSE,FALSE
,DLBA Owned Properties,Properties owned by the Detroit Land Bank Authority.,English,City of Detroit,"City of Detroit, Michigan",Geospatial data,,dlba|detroit,2020-11-09T16:16:48.000Z,,,,"Detroit, Michigan|Michigan","['-83.2867', '42.2556', '-82.9133', '42.4499']",Dataset|Service,Vector,Shapefile,https://data.detroitmi.gov/datasets/9d19438ea1ba443799a29c4d7e2034cd_10,https://data.detroitmi.gov/datasets/9d19438ea1ba443799a29c4d7e2034cd_10.zip,https://opengis.detroitmi.gov/opengis/rest/services/DLBA/DLBA/MapServer/10,,,9d19438ea1ba443799a29c4d7e2034cd_10,Michigan,07c-01,07c-01,Active,ArcGIS Hub,,Public,,FALSE,FALSE
,Auction Sales,Properties sold by the Detroit Land Bank Authority through the Auction program.For more information about the DLBA's sales programsclick here,English,City of Detroit,"City of Detroit, Michigan",Geospatial data,,dlba|detroit,2020-11-09T16:10:20.000Z,,,,"Detroit, Michigan|Michigan","['-83.2852', '42.2601', '-82.9137', '42.4496']",Dataset|Service,Vector,Shapefile,https://data.detroitmi.gov/datasets/f57521d19bc64272bfbdda97fefd759c_9,https://data.detroitmi.gov/datasets/f57521d19bc64272bfbdda97fefd759c_9.zip,https://opengis.detroitmi.gov/opengis/rest/services/DLBA/DLBA/MapServer/9,,,f57521d19bc64272bfbdda97fefd759c_9,Michigan,07c-01,07c-01,Active,ArcGIS Hub,,Public,,FALSE,FALSE
,Completed Residential Demolitions,"All demolitions of all structures since January 1, 2014.",English,City of Detroit,"City of Detroit, Michigan",Geospatial data,,demolitions|dlba,2020-11-09T15:51:02.000Z,,,,"Detroit, Michigan|Michigan","['-83.2867', '42.2562', '-82.9133', '42.4496']",Dataset|Service,Vector,Shapefile,https://data.detroitmi.gov/datasets/abdb4042934340b49dcd9675c11f9290_7,https://data.detroitmi.gov/datasets/abdb4042934340b49dcd9675c11f9290_7.zip,https://opengis.detroitmi.gov/opengis/rest/services/DLBA/DLBA/MapServer/7,,,abdb4042934340b49dcd9675c11f9290_7,Michigan,07c-01,07c-01,Active,ArcGIS Hub,,Public,,FALSE,FALSE
,Demolitions under Contract,opendata.dlba.contracted_demos,English,City of Detroit,"City of Detroit, Michigan",Geospatial data,,dlba,2020-11-09T15:39:12.000Z,,,,"Detroit, Michigan|Michigan","['-83.2535', '42.2643', '-82.9536', '42.4495']",Dataset|Service,Vector,Shapefile,https://data.detroitmi.gov/datasets/7eb3774721f7484da7530f800ad3bfd3_6,https://data.detroitmi.gov/datasets/7eb3774721f7484da7530f800ad3bfd3_6.zip,https://opengis.detroitmi.gov/opengis/rest/services/DLBA/DLBA/MapServer/6,,,7eb3774721f7484da7530f800ad3bfd3_6,Michigan,07c-01,07c-01,Active,ArcGIS Hub,,Public,,FALSE,FALSE
,Demolition Timing Status,opendata.dlba.demo_timing_status,English,City of Detroit,"City of Detroit, Michigan",Geospatial data,,demolitions,2020-11-06T22:47:29.000Z,,,,"Detroit, Michigan|Michigan","['-83.2867', '42.2563', '-82.9133', '42.4496']",Dataset|Service,Vector,Shapefile,https://data.detroitmi.gov/datasets/991161fae34f4e6999805dbf05937c95_4,https://data.detroitmi.gov/datasets/991161fae34f4e6999805dbf05937c95_4.zip,https://opengis.detroitmi.gov/opengis/rest/services/DLBA/DLBA/MapServer/4,,,991161fae34f4e6999805dbf05937c95_4,Michigan,07c-01,07c-01,Active,ArcGIS Hub,,Public,,FALSE,FALSE
,Neighborhood Police Officers,Neighborhood Police Officers by Scout Car Areas,English,City of Detroit,"City of Detroit, Michigan",Geospatial data,,publicsafety|detroit,2020-10-28T17:54:48.000Z,,,,"Detroit, Michigan|Michigan","['-83.2878', '42.2550', '-82.9104', '42.4504']",Dataset|Service,Vector,Shapefile,https://data.detroitmi.gov/datasets/4bbadc420cd84037ad578f982ee21b4c_0,https://data.detroitmi.gov/datasets/4bbadc420cd84037ad578f982ee21b4c_0.zip,,https://opengis.detroitmi.gov/opengis/rest/services/PublicSafety/NeighborhoodPoliceOfficers/FeatureServer/0,,4bbadc420cd84037ad578f982ee21b4c_0,Michigan,07c-01,07c-01,Active,ArcGIS Hub,,Public,,FALSE,FALSE
,PDD Planning Projects,Planning areas layer managed by PDD for any boundary update or new designation. Last updated 10/31/2019 - AN,English,City of Detroit,"City of Detroit, Michigan",Geospatial data,,PDD|PlanningProjects,2019-09-17T14:39:43.000Z,,,,"Detroit, Michigan|Michigan","['-83.2801', '42.2808', '-82.9097', '42.4500']",Dataset|Service,Vector,Shapefile,https://data.detroitmi.gov/datasets/1b7c2d22c6dd404a8ff8f422b31b7261_0,https://data.detroitmi.gov/datasets/1b7c2d22c6dd404a8ff8f422b31b7261_0.zip,,https://services2.arcgis.com/qvkbeam7Wirps6zC/arcgis/rest/services/PDD_Planning_Projects/FeatureServer/0,,1b7c2d22c6dd404a8ff8f422b31b7261_0,Michigan,07c-01,07c-01,Active,ArcGIS Hub,,Public,,FALSE,FALSE
,Commercial Demolitions,opendata.dlba.commercial_demos,English,City of Detroit,"City of Detroit, Michigan",Geospatial data,,dlba|detroit,2020-11-09T15:56:58.000Z,,,,"Detroit, Michigan|Michigan","['-83.2763', '42.2593', '-82.9407', '42.4496']",Dataset|Service,Vector,Shapefile,https://data.detroitmi.gov/datasets/2101f1e1819f4c8197290aabc536bb40_8,https://data.detroitmi.gov/datasets/2101f1e1819f4c8197290aabc536bb40_8.zip,https://opengis.detroitmi.gov/opengis/rest/services/DLBA/DLBA/MapServer/8,,,2101f1e1819f4c8197290aabc536bb40_8,Michigan,07c-01,07c-01,Active,ArcGIS Hub,,Public,,FALSE,FALSE
,Demo Pipeline,"Properties which have been identified as demolition candidates, but are not yet contracted for demolition.",English,City of Detroit,"City of Detroit, Michigan",Geospatial data,,dbla|detroit,2020-11-06T23:00:02.000Z,,,,"Detroit, Michigan|Michigan","['-83.2847', '42.2607', '-82.9204', '42.4486']",Dataset|Service,Vector,Shapefile,https://data.detroitmi.gov/datasets/330fa464475549e590e81d5b485d25ee_5,https://data.detroitmi.gov/datasets/330fa464475549e590e81d5b485d25ee_5.zip,https://opengis.detroitmi.gov/opengis/rest/services/DLBA/DLBA/MapServer/5,,,330fa464475549e590e81d5b485d25ee_5,Michigan,07c-01,07c-01,Active,ArcGIS Hub,,Public,,FALSE,FALSE
,IABBTSABlocksV3,"Data developed using FCC forma 477 data along with provider input to ConnectedNation. Data effective data is whether provider is able to provide a minimum of 25 Mbps download and 3 Mbps download as of July 31, 2020.",English,State of Iowa,State of Iowa,Geospatial data,,Iowa|eligiblegrantblocks|broadband|NOFA004|utilitiesCommunication,2020-10-27T16:01:54.000Z,,,,Iowa,"['-96.6849', '40.3325', '-90.0694', '43.5571']",Dataset|Service,Vector,Shapefile,https://open-iowa.opendata.arcgis.com/datasets/519914340c404479bb8aaa8627a55ed9_0,https://open-iowa.opendata.arcgis.com/datasets/519914340c404479bb8aaa8627a55ed9_0.zip,,https://services.arcgis.com/vPD5PVLI6sfkZ5E4/arcgis/rest/services/IABBTSABlocksV3/FeatureServer/0,,519914340c404479bb8aaa8627a55ed9_0,Iowa,03a-04,03a-04,Active,ArcGIS Hub,,Public,,FALSE,FALSE
,Iowa County Status,"Flood Risk Products help community officials and the public view and understand their local flood risk. The Flood Risk Products that may be available to your community are floodplain boundaries, flood depths, and potential flood scour. These products are non-regulatory resources that supplement the flood hazard information produced by the regulatory Flood Insurance Rate Map (FIRM), Flood Insurance Study (FIS) and FIRM database products. Both the general public and government officials are encouraged to use these free resources to help make better informed decisions about preparing for and mitigating flood loss.",English,Iowa Department of Natural Resources,State of Iowa,Geospatial data,,inlandWaters|Iowa|NHFL|surfacewaters|floodplain|DFIRM|FIRM|flooding|floods|floodrisk|FEMA,2020-11-10T20:38:18.000Z,,,,Iowa,"['-96.6395', '40.3757', '-90.1401', '43.5011']",Dataset|Service,Vector,Shapefile,https://open-iowa.opendata.arcgis.com/datasets/727675bc4fe34cf39ae3b826deecb74b_1,https://open-iowa.opendata.arcgis.com/datasets/727675bc4fe34cf39ae3b826deecb74b_1.zip,https://programs.iowadnr.gov/geospatial/rest/services/SurfaceWaters/FloodHazardAreas/MapServer/1,,,727675bc4fe34cf39ae3b826deecb74b_1,Iowa,03a-04,03a-04,Active,ArcGIS Hub,,Public,,FALSE,FALSE
,Zone,"Flood Risk Products help community officials and the public view and understand their local flood risk. The Flood Risk Products that may be available to your community are floodplain boundaries, flood depths, and potential flood scour. These products are non-regulatory resources that supplement the flood hazard information produced by the regulatory Flood Insurance Rate Map (FIRM), Flood Insurance Study (FIS) and FIRM database products. Both the general public and government officials are encouraged to use these free resources to help make better informed decisions about preparing for and mitigating flood loss.",English,Iowa Department of Natural Resources,State of Iowa,Geospatial data,,inlandWaters|Iowa|NHFL|surfacewaters|floodplain|DFIRM|FIRM|flooding|floods|floodrisk|FEMA,2020-11-10T20:38:18.000Z,,,,Iowa,"['-96.6395', '40.3754', '-90.1401', '43.5010']",Dataset|Service,Vector,Shapefile,https://open-iowa.opendata.arcgis.com/datasets/727675bc4fe34cf39ae3b826deecb74b_0,https://open-iowa.opendata.arcgis.com/datasets/727675bc4fe34cf39ae3b826deecb74b_0.zip,https://programs.iowadnr.gov/geospatial/rest/services/SurfaceWaters/FloodHazardAreas/MapServer/0,,,727675bc4fe34cf39ae3b826deecb74b_0,Iowa,03a-04,03a-04,Active,ArcGIS Hub,,Public,,FALSE,FALSE
,NOFA003 Awarded Blocks,,English,State of Iowa,State of Iowa,Geospatial data,,Iowa|NOFA003|broadband,2020-11-02T19:07:00.000Z,,,,Iowa,"['-96.1558', '40.6175', '-90.1726', '43.5002']",Dataset|Service,Vector,Shapefile,https://open-iowa.opendata.arcgis.com/datasets/bfdf9fd3c79d42b59ab2ef81009c3d21_0,https://open-iowa.opendata.arcgis.com/datasets/bfdf9fd3c79d42b59ab2ef81009c3d21_0.zip,,https://services.arcgis.com/vPD5PVLI6sfkZ5E4/arcgis/rest/services/NOFA003_blocks/FeatureServer/0,,bfdf9fd3c79d42b59ab2ef81009c3d21_0,Iowa,03a-04,03a-04,Active,ArcGIS Hub,,Public,,FALSE,FALSE
,Private Well Facilities,,English,Iowa Department of Natural Resources,State of Iowa,Geospatial data,,environment,2018-04-04T21:01:44.000Z,,,,Iowa,"['-96.7909', '39.9655', '-90.0574', '43.9474']",Dataset|Service,Vector,Shapefile,https://open-iowa.opendata.arcgis.com/datasets/8e8fcbd62a6e4f85a5d4d6242e934251_22,https://open-iowa.opendata.arcgis.com/datasets/8e8fcbd62a6e4f85a5d4d6242e934251_22.zip,https://programs.iowadnr.gov/geospatial/rest/services/OneStop/QueryEnvFacs/MapServer/22,,,8e8fcbd62a6e4f85a5d4d6242e934251_22,Iowa,03a-04,03a-04,Active,ArcGIS Hub,,Public,,FALSE,FALSE
,Storm Water Facilities 2 - Construction,,English,Iowa Department of Natural Resources,State of Iowa,Geospatial data,,environment,2018-04-04T21:01:44.000Z,,,,Iowa,"['-96.7909', '39.9655', '-90.0574', '43.9474']",Dataset|Service,Vector,Shapefile,https://open-iowa.opendata.arcgis.com/datasets/8e8fcbd62a6e4f85a5d4d6242e934251_17,https://open-iowa.opendata.arcgis.com/datasets/8e8fcbd62a6e4f85a5d4d6242e934251_17.zip,https://programs.iowadnr.gov/geospatial/rest/services/OneStop/QueryEnvFacs/MapServer/17,,,8e8fcbd62a6e4f85a5d4d6242e934251_17,Iowa,03a-04,03a-04,Active,ArcGIS Hub,,Public,,FALSE,FALSE
,Storm Water Facilities 3 - Industrial Rock/Asphalt,,English,Iowa Department of Natural Resources,State of Iowa,Geospatial data,,environment,2018-04-04T21:01:44.000Z,,,,Iowa,"['-96.7909', '39.9655', '-90.0574', '43.9474']",Dataset|Service,Vector,Shapefile,https://open-iowa.opendata.arcgis.com/datasets/8e8fcbd62a6e4f85a5d4d6242e934251_18,https://open-iowa.opendata.arcgis.com/datasets/8e8fcbd62a6e4f85a5d4d6242e934251_18.zip,https://programs.iowadnr.gov/geospatial/rest/services/OneStop/QueryEnvFacs/MapServer/18,,,8e8fcbd62a6e4f85a5d4d6242e934251_18,Iowa,03a-04,03a-04,Active,ArcGIS Hub,,Public,,FALSE,FALSE
,Water Use Facilities,,English,Iowa Department of Natural Resources,State of Iowa,Geospatial data,,environment,2018-04-04T21:01:44.000Z,,,,Iowa,"['-96.7909', '39.9655', '-90.0574', '43.9474']",Dataset|Service,Vector,Shapefile,https://open-iowa.opendata.arcgis.com/datasets/8e8fcbd62a6e4f85a5d4d6242e934251_21,https://open-iowa.opendata.arcgis.com/datasets/8e8fcbd62a6e4f85a5d4d6242e934251_21.zip,https://programs.iowadnr.gov/geospatial/rest/services/OneStop/QueryEnvFacs/MapServer/21,,,8e8fcbd62a6e4f85a5d4d6242e934251_21,Iowa,03a-04,03a-04,Active,ArcGIS Hub,,Public,,FALSE,FALSE
,Surface Water Intake - Water Use,,English,Iowa Department of Natural Resources,State of Iowa,Geospatial data,,environment,2018-04-04T21:01:44.000Z,,,,Iowa,"['-96.7909', '39.9655', '-90.0574', '43.9474']",Dataset|Service,Vector,Shapefile,https://open-iowa.opendata.arcgis.com/datasets/8e8fcbd62a6e4f85a5d4d6242e934251_27,https://open-iowa.opendata.arcgis.com/datasets/8e8fcbd62a6e4f85a5d4d6242e934251_27.zip,https://programs.iowadnr.gov/geospatial/rest/services/OneStop/QueryEnvFacs/MapServer/27,,,8e8fcbd62a6e4f85a5d4d6242e934251_27,Iowa,03a-04,03a-04,Active,ArcGIS Hub,,Public,,FALSE,FALSE
,Underground Storage Tank Facilities,,English,Iowa Department of Natural Resources,State of Iowa,Geospatial data,,environment,2018-04-04T21:01:44.000Z,,,,Iowa,"['-96.7909', '39.9655', '-90.0574', '43.9474']",Dataset|Service,Vector,Shapefile,https://open-iowa.opendata.arcgis.com/datasets/8e8fcbd62a6e4f85a5d4d6242e934251_9,https://open-iowa.opendata.arcgis.com/datasets/8e8fcbd62a6e4f85a5d4d6242e934251_9.zip,https://programs.iowadnr.gov/geospatial/rest/services/OneStop/QueryEnvFacs/MapServer/9,,,8e8fcbd62a6e4f85a5d4d6242e934251_9,Iowa,03a-04,03a-04,Active,ArcGIS Hub,,Public,,FALSE,FALSE
,Contaminated Sites Facilities,,English,Iowa Department of Natural Resources,State of Iowa,Geospatial data,,environment,2018-04-04T21:01:44.000Z,,,,Iowa,"['-96.7909', '39.9655', '-90.0574', '43.9474']",Dataset|Service,Vector,Shapefile,https://open-iowa.opendata.arcgis.com/datasets/8e8fcbd62a6e4f85a5d4d6242e934251_5,https://open-iowa.opendata.arcgis.com/datasets/8e8fcbd62a6e4f85a5d4d6242e934251_5.zip,https://programs.iowadnr.gov/geospatial/rest/services/OneStop/QueryEnvFacs/MapServer/5,,,8e8fcbd62a6e4f85a5d4d6242e934251_5,Iowa,03a-04,03a-04,Active,ArcGIS Hub,,Public,,FALSE,FALSE
,Wastewater Treatment Plant,,English,Iowa Department of Natural Resources,State of Iowa,Geospatial data,,environment,2018-04-04T21:01:44.000Z,,,,Iowa,"['-96.7909', '39.9655', '-90.0574', '43.9474']",Dataset|Service,Vector,Shapefile,https://open-iowa.opendata.arcgis.com/datasets/8e8fcbd62a6e4f85a5d4d6242e934251_13,https://open-iowa.opendata.arcgis.com/datasets/8e8fcbd62a6e4f85a5d4d6242e934251_13.zip,https://programs.iowadnr.gov/geospatial/rest/services/OneStop/QueryEnvFacs/MapServer/13,,,8e8fcbd62a6e4f85a5d4d6242e934251_13,Iowa,03a-04,03a-04,Active,ArcGIS Hub,,Public,,FALSE,FALSE
