identifier,code,title,alternativeTitle,description,genre,subject,format,type,geometryType,dateIssued,temporalCoverage,Date,spatialCoverage,spatial,provenance,publisher,creator,landingPage,downloadURL,webService,metadataURL,serverType,keywords
16011400fccd4310abade7b77866b88e_38,05b-27123,Recreational Structures,,"Recreation contain polygons that represent features including basketball courts, hockey rinks, playgrounds, skate parks, swimming pools and tennis courts. These structures were created from 2015 aerial photography observation and interpretation using stereo processing techniques.",Geospatial data,,Shapefile,Dataset|Service,Vector,2017-04-26T18:22:34.000Z,,,"Ramsey County, Minnesota|Minnesota","-93.2341,44.883,-92.9771,45.1285",Minnesota,"Ramsey County, Minnesota",Map Portal,http://data-ramseygis.opendata.arcgis.com/datasets/16011400fccd4310abade7b77866b88e_38,http://data-ramseygis.opendata.arcgis.com/datasets/16011400fccd4310abade7b77866b88e_38.zip,https://maps.co.ramsey.mn.us/arcgis/rest/services/OpenData/OpenData/FeatureServer/38,,FeatureServer,Infrastructure|location|recreation facilities|playgrounds|sports facilities.
c2922202c12b4c359a633377f2a923f4_29,05b-27123,Section Lines,,This dataset contains lines that represent the Public Land Survey (PLS) for Ramsey County Minnesota.,Geospatial data,,Shapefile,Dataset|Service,Vector,2017-04-26T20:25:22.000Z,,,"Ramsey County, Minnesota|Minnesota","-93.2284,44.8867,-92.9826,45.1248",Minnesota,"Ramsey County, Minnesota",Map Portal,http://data-ramseygis.opendata.arcgis.com/datasets/c2922202c12b4c359a633377f2a923f4_29,http://data-ramseygis.opendata.arcgis.com/datasets/c2922202c12b4c359a633377f2a923f4_29.zip,https://maps.co.ramsey.mn.us/arcgis/rest/services/OpenData/OpenData/FeatureServer/29,,FeatureServer,planningCadastre|township|range|PLSS|section lines|quarter section lines|government survey
1d885379344b4bd9b98beb6ba70f1175_1,05b-27123,Cities,,"This data set contains polygons that represent Municipal boundaries. The Municipal boundaries were originally digitized from MNDOT municipality maps. Over time, these boundaries have been edited to better match Ramsey County parcel data.",Geospatial data,,Shapefile,Dataset|Service,Vector,2014-11-29T20:49:52.000Z,,,"Ramsey County, Minnesota|Minnesota","-93.2284,44.8867,-92.9826,45.1248",Minnesota,"Ramsey County, Minnesota",Map Portal,http://data-ramseygis.opendata.arcgis.com/datasets/1d885379344b4bd9b98beb6ba70f1175_1,http://data-ramseygis.opendata.arcgis.com/datasets/1d885379344b4bd9b98beb6ba70f1175_1.zip,https://maps.co.ramsey.mn.us/arcgis/rest/services/OpenData/OpenData/MapServer/1,,MapServer,Cities|Municipalities|Administrative
c43ee9d6f99741bb8691ead89dc2c23c_26,05b-27123,Control Corners,,"This data set contains points that represent section corners. In 1985, Ramsey County began a 5 year project to modernize it's land records mapping system to create a computerized Land Information System. As part of the project, the County developed an accurate coordinate control base for this mapping system. The 27 existing State and Federal first order accuracy positions in Ramsey County were densified by a GPS (Global Positioning System) Network of 171 second order accuracy positions. These positions were established and recorded on existing public land survey corner monuments and accessory monuments through out the county.",Geospatial data,,Shapefile,Dataset|Service,Vector,2014-12-01T22:16:07.000Z,,,"Ramsey County, Minnesota|Minnesota","-93.2361,44.8903,-92.9791,45.1248",Minnesota,"Ramsey County, Minnesota",Map Portal,http://data-ramseygis.opendata.arcgis.com/datasets/c43ee9d6f99741bb8691ead89dc2c23c_26,http://data-ramseygis.opendata.arcgis.com/datasets/c43ee9d6f99741bb8691ead89dc2c23c_26.zip,https://maps.co.ramsey.mn.us/arcgis/rest/services/OpenData/OpenData/FeatureServer/26,,FeatureServer,PLSS|Survey|Control Corners
e1d26ac7a8944f1f8059f5659f656fe1_11,05b-27123,Parcel Points,,"Attributed Parcel Point contains data fields previously contained in Ramsey County Users Group shapefiles, ParPts and OnLineCore, and MetroGIS Parcel Datasets. These fields are populated from a compilation of records and information from various state, county and city offices, and other sources. This data is joined to Ramsey Countys Parcel Point data using a property identification number (PIN) which is assigned to both polygons and points and is the primary link to county tax and assessment data.?In 1986, parcels were digitized from hand drawn 1:2400 half and 1:1200 quarter section maps. In 1995, the parcel data layer was converted to ArcINFO format and held in the ArcStorm data base. Parcel Points were created from parcel centroids. Parcel Points were converted in 2005 to an ESRI ArcGIS GeoDatabase.?When Parcel Points were originally created, there was a one-to-one relationship with identical PINs on both Parcel Polygons and Parcel Points with additional Parcel Points added for Common Interest Communities, Apartment Ownerships or Condominiums, where there is a one-to-many relationship with the Parcel Polygon having the smallest PIN for all associated Parcel Points. Parcel Points were also added for Manufactured Homes and are being added for Apartment Units. The PIN for Manufactured Homes contains a number for the Manufactured Home Park followed by an M then a unique number. The PIN for Apartments Units begins with a U and is followed by the PIN for the Parcel Polygon; attribute data for Apartment Units consists primarily of site address information. The Attributed Parcel Point field, TaxParcelID, can be used to identify the associated Parcel Polygon based on its PIN, and ParcelCode can be used to identify if there is a one-to-many relationship between the point  polygon features.",Geospatial data,,Shapefile,Dataset|Service,Vector,2014-12-01T18:05:36.000Z,,,"Ramsey County, Minnesota|Minnesota","-93.2282,44.8909,-92.9829,45.1245",Minnesota,"Ramsey County, Minnesota",Map Portal,http://data-ramseygis.opendata.arcgis.com/datasets/e1d26ac7a8944f1f8059f5659f656fe1_11,http://data-ramseygis.opendata.arcgis.com/datasets/e1d26ac7a8944f1f8059f5659f656fe1_11.zip,https://maps.co.ramsey.mn.us/arcgis/rest/services/OpenData/OpenData/FeatureServer/11,,FeatureServer,Cadastral|Parcels
ba48ceeb5a01436ca8c0e5c39ca2971c_21,05b-27123,Subdivisions,,"This dataset contains Subdivisions, which includes Subdivision and Registered Land Survey (RLS) Plats.?",Geospatial data,,Shapefile,Dataset|Service,Vector,2017-04-26T16:25:54.000Z,,,"Ramsey County, Minnesota|Minnesota","-93.2284,44.8905,-92.9827,45.1247",Minnesota,"Ramsey County, Minnesota",Map Portal,http://data-ramseygis.opendata.arcgis.com/datasets/ba48ceeb5a01436ca8c0e5c39ca2971c_21,http://data-ramseygis.opendata.arcgis.com/datasets/ba48ceeb5a01436ca8c0e5c39ca2971c_21.zip,https://maps.co.ramsey.mn.us/arcgis/rest/services/OpenData/OpenData/FeatureServer/21,,FeatureServer,Subdivision|Cadastral|Parcel|Ramsey County|Plat|Registered Land Survey.
a65ffcd4c1224620870d9abd56379c71_0,05b-27123,Transportation Structures,,"Transportation Structures contain polygon features including alleys, bridges, driveways, paved and unpaved roads, sidewalks and trails. These features were created from 2015 aerial photography observation and interpretation using stereo processing techniques.",Geospatial data,,Shapefile,Dataset|Service,Vector,2019-11-27T16:35:12.000Z,,,"Ramsey County, Minnesota|Minnesota","-93.2343,44.8819,-92.9733,45.1292",Minnesota,"Ramsey County, Minnesota",Map Portal,http://data-ramseygis.opendata.arcgis.com/datasets/a65ffcd4c1224620870d9abd56379c71_0,http://data-ramseygis.opendata.arcgis.com/datasets/a65ffcd4c1224620870d9abd56379c71_0.zip,https://services2.arcgis.com/527XtFVf9JKOTqu5/arcgis/rest/services/Transportation_gdb/FeatureServer/0,,FeatureServer,Transportation
2e1efae7d7d244afb08f2b011e031d25_8,05b-27123,Water Bodies,,"This data set contains open water area outlines including, creeks, lakes, rivers. This data set also contains islands within open water areas. The open water areas are created from aerial photography observation and interpretation using stereo processing techniques. Vector line work was originally plotted from 2009 photography. All graphical lines contain a character based layer name that identifies the different mapping features.",Geospatial data,,Shapefile,Dataset|Service,Vector,2014-12-01T19:52:31.000Z,,,"Ramsey County, Minnesota|Minnesota","-93.2345,44.8815,-92.9605,45.1379",Minnesota,"Ramsey County, Minnesota",Map Portal,http://data-ramseygis.opendata.arcgis.com/datasets/2e1efae7d7d244afb08f2b011e031d25_8,http://data-ramseygis.opendata.arcgis.com/datasets/2e1efae7d7d244afb08f2b011e031d25_8.zip,https://maps.co.ramsey.mn.us/arcgis/rest/services/OpenData/OpenData/FeatureServer/8,,FeatureServer,Environmental|Water Bodies
e19d432ecf284c9eb1d399828aa87034_15,05b-27123,Easements,,"Easement boundaries support many functions including automated half and quarter section map production, thematic mapping, land records and property assessment and surveying and engineering projects.",Geospatial data,,Shapefile,Dataset|Service,Vector,2017-04-26T15:59:29.000Z,,,"Ramsey County, Minnesota|Minnesota","-93.2284,44.8904,-92.9826,45.1248",Minnesota,"Ramsey County, Minnesota",Map Portal,http://data-ramseygis.opendata.arcgis.com/datasets/e19d432ecf284c9eb1d399828aa87034_15,http://data-ramseygis.opendata.arcgis.com/datasets/e19d432ecf284c9eb1d399828aa87034_15.zip,https://maps.co.ramsey.mn.us/arcgis/rest/services/OpenData/OpenData/FeatureServer/15,,FeatureServer,Easement|Cadastral|Parcel|Ramsey County
7a78306bd3ca4cbd8566861184e8acba_18,05b-27123,Parcel Info,,"This dataset contains miscellaneous linework that assists with map creation and clarification. Examples of graphical features represented in this database are: old or vacated lot lines, lines, right of way and plat boundary extension lines.The parcel information data layer represents various parcel related graphical elements, which aid in the understanding and interpretation of map features.  It is not intended to be inclusive. It is intended to act as a visual aid to help with map interpretation.",Geospatial data,,Shapefile,Dataset|Service,Vector,2017-04-26T16:14:13.000Z,,,"Ramsey County, Minnesota|Minnesota","-93.2284,44.887,-92.9827,45.1246",Minnesota,"Ramsey County, Minnesota",Map Portal,http://data-ramseygis.opendata.arcgis.com/datasets/7a78306bd3ca4cbd8566861184e8acba_18,http://data-ramseygis.opendata.arcgis.com/datasets/7a78306bd3ca4cbd8566861184e8acba_18.zip,https://maps.co.ramsey.mn.us/arcgis/rest/services/OpenData/OpenData/FeatureServer/18,,FeatureServer,Parcel Info|Cadastral|Ramsey County
1932268e84324be0be76b3593b3f56fe_31,05b-27123,Half Sections,,"This data set contains polygons that represent half sections. In 1985, Ramsey County began a 5 year project to modernize it's land records mapping system to create a computerized Land Information System. As part of the project, the County developed an accurate coordinate control base for this mapping system. The 27 existing State and Federal first order accuracy positions in Ramsey County were densified by a GPS (Global Positioning System) Network of 171 second order accuracy positions. These positions were established and recorded on existing public land survey corner monuments and accessory monuments through out the county.",Geospatial data,,Shapefile,Dataset|Service,Vector,2014-12-01T22:46:12.000Z,,,"Ramsey County, Minnesota|Minnesota","-93.2284,44.8867,-92.9826,45.1248",Minnesota,"Ramsey County, Minnesota",Map Portal,http://data-ramseygis.opendata.arcgis.com/datasets/1932268e84324be0be76b3593b3f56fe_31,http://data-ramseygis.opendata.arcgis.com/datasets/1932268e84324be0be76b3593b3f56fe_31.zip,https://maps.co.ramsey.mn.us/arcgis/rest/services/OpenData/OpenData/FeatureServer/31,,FeatureServer,PLSS|Survey|Half Sections
4ec0f4c8e2364ce3b489efae2bda6125_43,05b-27123,Streets,,"Streets provide a routable network of federal, state, county and municipal and private roads. All public roads should be represented in the database as well as many of the private roads that are open to the general public. A private section of pavement that serves less than three households is generally considered a private drive and is not included in this set. The features are intended to represent the driving surfaces of the roads, and are often near the center of the road pavement, however, this varies by feature. Where the pavement is divided by a median or raised divider of more than 50', a separate feature represents the pavement in each direction (a dual carriageway representation). The center of physical roadway pavement may or may not represent the center of the road right of way. Road right of ways may taper or change width. There has been no attempt to alter the road centerline to conform to right of way that is not parallel or alters in width.This data set provides a routable street network of federal, state, county and municipal roads with address attribution appropriate for geocoding. Many of the current attributes were added to support the Ramsey County Computer Aided Dispatch system.",Geospatial data,,Shapefile,Dataset|Service,Vector,2014-12-01T20:43:06.000Z,,,"Ramsey County, Minnesota|Minnesota","-93.2287,44.8904,-92.9818,45.1252",Minnesota,"Ramsey County, Minnesota",Map Portal,http://data-ramseygis.opendata.arcgis.com/datasets/4ec0f4c8e2364ce3b489efae2bda6125_43,http://data-ramseygis.opendata.arcgis.com/datasets/4ec0f4c8e2364ce3b489efae2bda6125_43.zip,https://maps.co.ramsey.mn.us/arcgis/rest/services/OpenData/OpenData/FeatureServer/43,,FeatureServer,transportation|street
6bc3335f610d4f3a9059b783fbc91f26_20,05b-27123,Special Surveys,,"This dataset contains Special Survey, which includes Metes and Bounds parcels and surveyed water.",Geospatial data,,Shapefile,Dataset|Service,Vector,2017-04-26T16:20:36.000Z,,,"Ramsey County, Minnesota|Minnesota","-93.2283,44.887,-92.9827,45.1246",Minnesota,"Ramsey County, Minnesota",Map Portal,http://data-ramseygis.opendata.arcgis.com/datasets/6bc3335f610d4f3a9059b783fbc91f26_20,http://data-ramseygis.opendata.arcgis.com/datasets/6bc3335f610d4f3a9059b783fbc91f26_20.zip,https://maps.co.ramsey.mn.us/arcgis/rest/services/OpenData/OpenData/FeatureServer/20,,FeatureServer,Special Survey|Cadastral|Parcel|Ramsey County
77c001274c174978a1af2c92afd98da3_14,05b-27123,Conveyance Divisions,,"Conveyance Division boundaries support many functions including automated half and quarter section map production, thematic mapping, land records and property assessment, and surveying and engineering projects.",Geospatial data,,Shapefile,Dataset|Service,Vector,2017-04-26T15:38:48.000Z,,,"Ramsey County, Minnesota|Minnesota","-95.2994,44.493,-92.9828,45.1317",Minnesota,"Ramsey County, Minnesota",Map Portal,http://data-ramseygis.opendata.arcgis.com/datasets/77c001274c174978a1af2c92afd98da3_14,http://data-ramseygis.opendata.arcgis.com/datasets/77c001274c174978a1af2c92afd98da3_14.zip,https://maps.co.ramsey.mn.us/arcgis/rest/services/OpenData/OpenData/FeatureServer/14,,FeatureServer,Division|Cadstral|Parcel|Ramsey County
d2476e90a54c4e3cbb24b2c3cb53ef1b_27,05b-27123,Government Lots,,"This dataset contains polygons that represent Government Lots, which are a subpart of a section. These lots may be regular or irregular in shape and frequently border water areas, which are excluded from the PLSS./",Geospatial data,,Shapefile,Dataset|Service,Vector,2017-04-26T20:21:51.000Z,,,"Ramsey County, Minnesota|Minnesota","-93.208,44.8905,-92.9827,45.1245",Minnesota,"Ramsey County, Minnesota",Map Portal,http://data-ramseygis.opendata.arcgis.com/datasets/d2476e90a54c4e3cbb24b2c3cb53ef1b_27,http://data-ramseygis.opendata.arcgis.com/datasets/d2476e90a54c4e3cbb24b2c3cb53ef1b_27.zip,https://maps.co.ramsey.mn.us/arcgis/rest/services/OpenData/OpenData/FeatureServer/27,,FeatureServer,planningCadastre|township|range|PLSS|government lots
0782c58466f445fb9c8bd84f0e26944a_26,05b-27123,Benchmarks,,"Benchmarks are relatively permanent objects having a marked point, whose elevation above or below an adopted datum, is known or assumed. Vertical control is a series of bench marks or other points of known elevation established throughout an area.?",Geospatial data,,Shapefile,Dataset|Service,Vector,2014-12-04T17:16:23.000Z,,,"Ramsey County, Minnesota|Minnesota","-93.2361,44.8903,-92.9791,45.1248",Minnesota,"Ramsey County, Minnesota",Map Portal,http://data-ramseygis.opendata.arcgis.com/datasets/0782c58466f445fb9c8bd84f0e26944a_26,http://data-ramseygis.opendata.arcgis.com/datasets/0782c58466f445fb9c8bd84f0e26944a_26.zip,https://maps.co.ramsey.mn.us/arcgis/rest/services/OpenData/OpenData/FeatureServer/26,,FeatureServer,PLSS|Survey|Benchmarks
915b0721cda1403a96cedf57189ada38_41,05b-27123,Ped Bike System,,"The Pedestrian Bike Systems (PBS) data set contains line data that represents non-motorized-wheeled (bike, rollerblade, skateboard, etc.) and pedestrian transit routes. Some of the sidewalk and trail locations were originally digitized from Ramsey County 2003 aerial photography DOQs.",Geospatial data,,Shapefile,Dataset|Service,Vector,2017-04-26T19:59:51.000Z,,,"Ramsey County, Minnesota|Minnesota","-93.2315,44.8882,-92.9796,45.1283",Minnesota,"Ramsey County, Minnesota",Map Portal,http://data-ramseygis.opendata.arcgis.com/datasets/915b0721cda1403a96cedf57189ada38_41,http://data-ramseygis.opendata.arcgis.com/datasets/915b0721cda1403a96cedf57189ada38_41.zip,https://maps.co.ramsey.mn.us/arcgis/rest/services/OpenData/OpenData/FeatureServer/41,,FeatureServer,transportation|pedestrian|bike|routes|trails|sidewalks
b0361949f803400487a120fc96b95fcd_5,05b-27123,Elevations,,{{default.description}},Geospatial data,,Shapefile,Dataset|Service,Vector,2018-07-23T20:15:40.000Z,,,"Ramsey County, Minnesota|Minnesota","-93.2508,44.8741,-92.9672,45.1259",Minnesota,"Ramsey County, Minnesota",Map Portal,http://data-ramseygis.opendata.arcgis.com/datasets/b0361949f803400487a120fc96b95fcd_5,http://data-ramseygis.opendata.arcgis.com/datasets/b0361949f803400487a120fc96b95fcd_5.zip,https://maps.co.ramsey.mn.us/arcgis/rest/services/OpenData/OpenData/FeatureServer/5,,FeatureServer,Ramsey County|Environmental|elevation
fb3e21546ba14a67a95f703f9981f615_37,05b-27123,Parking Structures,,Parking contain polygons that represent paved and unpaved parking features. These structures were created from 2015 aerial photography observation and interpretation using stereo processing techniques.,Geospatial data,,Shapefile,Dataset|Service,Vector,2017-04-26T18:18:57.000Z,,,"Ramsey County, Minnesota|Minnesota","-93.234,44.883,-92.9734,45.1296",Minnesota,"Ramsey County, Minnesota",Map Portal,http://data-ramseygis.opendata.arcgis.com/datasets/fb3e21546ba14a67a95f703f9981f615_37,http://data-ramseygis.opendata.arcgis.com/datasets/fb3e21546ba14a67a95f703f9981f615_37.zip,https://maps.co.ramsey.mn.us/arcgis/rest/services/OpenData/OpenData/FeatureServer/37,,FeatureServer,location|structure|parking lot|infrascructure
5559f1d635fc484c93ccc45a3caa787e_2,05b-27123,Commissioner Districts,,This data set contains polygons that represent Ramsey County Commissioner Districts as of the redistricting process following the 2010 census. The boundaries were created by merging Federal Census Blocks.,Geospatial data,,Shapefile,Dataset|Service,Vector,2014-11-29T20:01:53.000Z,,,"Ramsey County, Minnesota|Minnesota","-93.2284,44.8867,-92.9826,45.1248",Minnesota,"Ramsey County, Minnesota",Map Portal,http://data-ramseygis.opendata.arcgis.com/datasets/5559f1d635fc484c93ccc45a3caa787e_2,http://data-ramseygis.opendata.arcgis.com/datasets/5559f1d635fc484c93ccc45a3caa787e_2.zip,https://maps.co.ramsey.mn.us/arcgis/rest/services/OpenData/OpenData/MapServer/2,,MapServer,Commissioner Districts|Administrative
4b496601fd324038b990dbd906444c7a_0,05c-01,Structural Fires,,"For questions about this data please contact?FireOpenData@minneapolismn.govField
Descriptions??alarmDate

o??
Date of the alarm

?????????
alarmTime?

o??
Text

o??
Time of the alarm

?????????
IncidentID

o??
Text

o??
Incident identifier associated with
fire

?????????
IncidentNumber

o??
Text

o??
Incident number associated with the
call

?????????
Address

o???
Text

o??
Address of structural fire.

?????????
City

o???
Text

o??
City fire was located in.

?????????
Zip

o???
Text

o??
Zip code fire was located in.

?????????
incidentType?

o??
Text

o??
Type of incident according to NFIRS
coding, ie. Fire, EMS/Rescue, Service call etc.

?????????
PropertyUse

o???
Text

o??
Category the property is assigned
regarding purpose.

?????????
fireSpread

o???
text

o??
Degree to which the fire expanded.

?????????
propertyLoss

o???
number

o??
Cost of damage to structure involved
in fire.

?????????
contentLoss

o???
number

o??
Cost of damage to contents of
structure involved in fire.

?????????
latitude?

o??
Number

o??
Latitude of fire

?????????
longitude?

o??
Number

o??
longitude of fire

",Suspicious coordinates,,Shapefile,Dataset|Service,Vector,2019-12-06T15:52:36.000Z,,,District of Columbia|Maryland,"-93.3565,0,0,45.0963",Minnesota,"City of Minneapolis, Minnesota",MapIT Minneapolis,http://opendata.minneapolismn.gov/datasets/4b496601fd324038b990dbd906444c7a_0,http://opendata.minneapolismn.gov/datasets/4b496601fd324038b990dbd906444c7a_0.zip,https://services.arcgis.com/afSMGVsC7QlRK1kZ/arcgis/rest/services/Structural_Fires/FeatureServer/0,,FeatureServer,Minneapolis|Open Data|MFD|Fire|Public Safety
dc71f28326644345aaf482f986ed395c_0,05c-01,Snow Emergency Fremont Tows 2019,,"Description
This is the information about the number and location of tows during this snow emergency. Tow data will be retained for all Snow Emergencies in each snow season, until there is five full seasons of snow emergencies. 

Disclaimer: There is an expected address error rate of between 8 and 14 percent. 

Snow Emergency Tows ? 2019/2020 Season #1 Fremont (11/27/19 thru 11/29/19)
 
 
 
 
  Field Name
  Field Type
  Field
  Description
 
 
  FID
  Object ID
  Object ID
 
 
  Call_Taken
  Text
  Date and time tag
  written
 
 
  Customer
  Text
  Snow Emergency
 
 
  Location?
  Text
  Address
 
 
  Latitude
  Numeric
  X Coordinate -
  Geocode
 
 
  Longitude
  Numeric
  Y Coordinate -
  Geocode
 
 
  Day
  Text
  Day of event
 
 
  Ward
  Text
  Ward number 1 - 13
 
 
  Community
  Text
  Name of Community
 
 
  Neighborho
  Text
  Name of Neighborhood
 
 
  Tow_Zone
  Text
  Tow District
 
 
  Snow_Emerg
  Text
  Event Name
 ",Geospatial data,,Shapefile,Dataset|Service,Vector,2019-12-04T21:08:14.000Z,,,District of Columbia|Maryland,"-93.3188,44.899,-93.2154,45.0399",Minnesota,"City of Minneapolis, Minnesota",MapIT Minneapolis,http://opendata.minneapolismn.gov/datasets/dc71f28326644345aaf482f986ed395c_0,http://opendata.minneapolismn.gov/datasets/dc71f28326644345aaf482f986ed395c_0.zip,https://services.arcgis.com/afSMGVsC7QlRK1kZ/arcgis/rest/services/Snow_Emergency_Fremont_Tows_2019/FeatureServer/0,,FeatureServer, 2019| Minneapolis| Public Works| Snow Emergency| Tows
e1c4353aad6f4010bfa809876bf6d051_0,05c-01,Snow Emergency Fremont Tags 2019,,"This is the information about the number and location of tags (parking tickets) during this snow emergency. Tag data will be retained for all Snow Emergencies in each snow season, until there is five full seasons of snow emergencies. Disclaimer: At this point we only have the tag data enclosed for day 2 and day 3 the snow emergencies. Day 1 tag data is collected manually and is not available at this time electronically.
 
 
 
 
  Field Name
  Field Type
  Field Description
 
 
  FID
  Object ID
  Object ID
 
 
  Citation_N
  Text254
  Citation Number
 
 
  Address
  Text 254
  Address of the citation
 
 
  Latitude
  Numeric
  X Coordinate - Geocode
 
 
  Longitude
  Numeric
  Y Coordinate -
  Geocode
 
 
  Neighborho
  Text 254
  Neighborhood Location
 
 
  Community
  Text 254
  Community Location
 
 
  Ward
  Text 254
  Ward Location
 
 
  Day_ID
  Numeric
  Snow Emergency Day
  Identifier
 
 
  Date
  Date
  Citation Date
 
 
  Code
  Text 254
  Snow Emergency
  Parking Ordinance
 
 
  Descriptio
  Text 2
  Snow Emergency
  Parking Ordinance Description
 
 
  Tow_Dist
  Double 15
  Tow Districts
  Identifier
 
 
  Snow_Emerg
  Text
  Event Name
 ",Geospatial data,,Shapefile,Dataset|Service,Vector,2019-12-04T21:39:50.000Z,,,District of Columbia|Maryland,"-93.3276,44.8908,-93.2089,45.0494",Minnesota,"City of Minneapolis, Minnesota",MapIT Minneapolis,http://opendata.minneapolismn.gov/datasets/e1c4353aad6f4010bfa809876bf6d051_0,http://opendata.minneapolismn.gov/datasets/e1c4353aad6f4010bfa809876bf6d051_0.zip,https://services.arcgis.com/afSMGVsC7QlRK1kZ/arcgis/rest/services/Snow_Emergency_Fremont_Tags_2019/FeatureServer/0,,FeatureServer, 2019| Minneapolis| Public Works| Snow Emergency| Tags
4bee8d6b81e143e1acbe78f544292c84,11a-01,Parcel Split-Combine Update 11-17-2019,,"This dataset contains parcel splits/combines in Stark County, Ohio between 11/07/2019 and 11/14/2019. Information about old and new parcel number and city, village, or township are also included.",error,,error,error,,2019-11-17T11:14:20.000Z,,,Ohio,"-81.7986,40.6023,-80.9122,41.0372",Ohio State,,Stark County Ohio,http://ogrip-geohio.opendata.arcgis.com/datasets/4bee8d6b81e143e1acbe78f544292c84,error,,,,Stark County|Ohio|Parcel|Split|Combine|Open Data|ParcelUpdate
9ab39b14dd9c4ef6ba182bcd0a22c0fd,11a-01,Group Quarters - Central Ohio,,{{default.description}},Flagged,,ArcGIS Hub Dataset|Esri Rest API,,,2019-12-03T13:53:55.000Z,,,Ohio,,Ohio State,,agol4cogis,http://ogrip-geohio.opendata.arcgis.com/datasets/9ab39b14dd9c4ef6ba182bcd0a22c0fd,,https://morpc.maps.arcgis.com/apps/webappviewer/index.html?id=9ab39b14dd9c4ef6ba182bcd0a22c0fd,,,MORPC|Group Quarters|POI|points of interest|Land Use
